label,text
spam,dear xxxxxxx uve been invited to xchat this is our final attempt to contact u txt chat to p msgrcvdhg suite lands row w j hl ldn yrs
ham,u will switch your fone on dammit
ham,yup i thk so until e shop closes lor
ham,so how many days since then
ham,no dice art class thru thanks though any idea what time i should come tomorrow
ham,either way works for me i am lt gt years old hope that doesnt bother you
ham,sad story of a man last week was my bday my wife didnt wish me my parents forgot n so did my kids i went to work even my colleagues did not wish
spam,you have won a guaranteed cash or a prize to claim yr prize call our customer service representative on between am pm cost p
ham,hey chief can you give me a bell when you get this need to talk to you about this royal visit on the st june
spam,do you want anytime any network mins text and a new video phone for only five pounds per week call or reply for delivery tomorrow
ham,if u sending her home first its ok lor im not ready yet
ham,purity of friendship between two is not about smiling after reading the forwarded message its about smiling just by seeing the name gud evng
ham,pls ask macho how much is budget for bb bold is cos i saw a new one for lt gt dollars
ham,sounds good keep me posted
ham,gd luck ur exams
ham,yep at dereks house now see you sunday lt
ham,are you in the pub
spam,st wk free gr tones str u each wk txt nokia on to for classic nokia tones or hit on to for polys nokia p poly p
ham,hey elaine is todays meeting still on
ham,alright ill make sure the car is back tonight
spam,call freephone now
ham,living is very simple loving is also simple laughing is too simple winning is tooo simple but being simple is very difficult
ham,yes i thought so thanks
spam,mila age blonde new in uk i look sex with uk guys if u like fun with me text mtalk to pp txt st free increments help
ham,i was slept that time you there
ham,my darling sister how are you doing whens school resuming is there a minimum wait period before you reapply do take care
ham,and hows your husband
ham,prepare to be pleasured
ham,don know wait i will check it
spam,free video camera phones with half price line rental for mths and cross ntwk mins txts call mobileupd or call optout
ham,sorry was in the bathroom sup
ham,alrite
ham,ok im gonna head up to usf in like fifteen minutes
ham,say this slowly god i love you amp i need you clean my heart with your blood send this to ten special people amp u c miracle tomorrow do it pls pls do it
ham,i just really need shit before tomorrow and i know you wont be awake before like
spam,for ur chance to win a cash every wk txt action to ts cs www movietrivia tv custcare x p wk
ham,its wylie you in tampa or sarasota
spam,your unique user id is for removal send stop to customer services
ham,can you just come in for a sec theres somebody here i want you to see
spam,thanks for your ringtone order reference number x your mobile will be charged should your tone not arrive please call customer services from colour red text colour txtstar
ham,you know wot people wear t shirts jumpers hat belt is all we know we r at cribbs
ham,howz that persons story
spam,bears pic nick and tom pete and dick in fact all types try gay chat with photo upload call p min stop texts call
ham,haha mayb ure rite u know me well da feeling of being liked by someone is gd lor u faster go find one then all gals in our group attached liao
ham,for you information ikea is spelled with all caps that is not yelling when you thought i had left you you were sitting on the bed among the mess when i came in i said we were going after you got home from class please dont try and bullshit me it makes me want to listen to you less
ham,yeah no probs last night is obviously catching up with you speak soon
spam,private your account statement for xxxxxx shows un redeemed s i m points call identifier code expires
ham,oh as usual vijay film or its different
ham,not a lot has happened here feels very quiet beth is at her aunts and charlie is working lots just me and helen in at the mo how have you been
ham,then she buying today no need to c meh
ham,a famous quote when you develop the ability to listen to anything unconditionally without losing your temper or self confidence it means you are married
ham,been up to ne thing interesting did you have a good birthday when are u wrking nxt i started uni today
ham,good morning princess how are you
ham,so gd got free ice cream i oso wan
ham,minimum walk is miles a day
ham,ill call you evening ill some ideas
spam,mobile club choose any of the top quality items for your mobile cfca a
ham,yes gauti and sehwag out of odi series
ham,we know taj mahal as symbol of love but the other lesser known facts mumtaz was shahjahans th wife out of his wifes shahjahan killed mumtazs husband to marry her mumtaz died in her lt gt th delivery he then married mumtazs sister question arises where the hell is the love the great hari
spam,more people are dogging in your area now call and join like minded guys why not arrange yourself theres this evening a minapn ls bb
ham,i probably wont eat at all today i think im gonna pop how was your weekend did u miss me
ham,now get step outta the way congrats again
ham,can you plz tell me the ans bslvyl sent via fullonsms com
ham,some are lasting as much as hours you might get lucky
ham,tonight yeah id be down for that
ham,convey my regards to him
ham,actually im waiting for weeks when they start putting ad
ham,pls come quick cant bare this
ham,oh ok wait me there my lect havent finish
spam,camera you are awarded a sipix digital camera call fromm landline delivery within days
spam,urgent your mobile no xxx won a bonus caller prize on this is the nd attempt to reach you call asap box n qp ppm
ham,ok lor but buy wat
ham,no we sell it all so well have tons if coins then sell our coins to someone thru paypal voila money back in life pockets
ham,you tell what happen dont behave like this to me ok no need to say
spam,please call our customer service representative on freephone between am pm as you have won a guaranteed cash or prize
ham,we will meet soon princess ttyl
ham,dude how do you like the buff wind
ham,i am getting threats from your sales executive shifad as i raised complaint against him its an official message
ham,i want snow its just freezing and windy
ham,aight we can pick some up you open before tonight
ham,u having lunch alone i now so bored
ham,like a personal sized or what
ham,in the end she might still vomit but its okay not everything will come out
ham,yes i come to nyc for audiitions and am trying to relocate
spam,will u meet ur dream partner soon is ur career off a flyng start find out free txt horo followed by ur star sign e g horo aries
spam,private your account statement for shows un redeemed s i m points call identifier code expires
ham,hi happy birthday hi hi hi hi hi hi hi
ham,carry on not disturbing both of you
ham,can you do online transaction
ham,ill b down soon
ham,actually getting ready to leave the house
ham,babe how goes that day what are you doing where are you i sip my cappuccino and think of you my love i send a kiss to you from across the sea
ham,meet you in corporation st outside gap you can see how my mind is working
ham,aiyar sorry lor forgot tell u
ham,have your lunch and come quickly and open the door
ham,joys father is john then john is the of joys father if u ans ths you hav lt gt iq tis s ias question try to answer
spam,loan for any purpose homeowners tenants welcome have you been previously refused we can still help call free or text back help
ham,tiwary to rcb battle between bang and kochi
ham,have you not finished work yet or something
ham,naughty little thought its better to flirt flirt n flirt rather than loving someone n gettin hurt hurt n hurt gud nyt
ham,god created gap btwn ur fingers so dat sum vry special will fill those gaps by holding ur hands now plz dont ask y he created so much gap between legs
ham,here got lots of hair dresser fr china
ham,wait i will msg after lt gt min
ham,hi the way i was with u day is the normal way this is the real me ur unique i hope i know u the rest of mylife hope u find wot was lost
ham,do you like shaking your booty on the dance floor
ham,whom you waited for yesterday
ham,aight do you still want to get money
ham,yes last practice
ham,honestly ive just made a lovely cup of tea and promptly dropped my keys in it and then burnt my fingers getting them out
ham,no few hours before went to hair cut
ham,no my blankets are sufficient thx
ham,no its not specialisation can work but its slave labor will look for it this month sha cos no shakara beggar
spam,reply to win weekly what professional sport does tiger woods play send stop to to end service
ham,u repeat e instructions again wats e road name of ur house
ham,really good dhanush rocks once again
spam,free msg single find a partner in your area s of real people are waiting to chat now send chat to cncl send stopcs per msg
ham,i can probably come by everybodys done around lt gt right
ham,lt gt w jetton ave if you forgot
ham,sorry ill call later
ham,night night see you tomorrow
ham,yunny im goin to be late
ham,can send me a copy of da report
spam,thanks for the vote now sing along with the stars with karaoke on your mobile for a free link just reply with sing now
ham,ok
ham,lol have you made plans for new years
ham,lt gt mins but i had to stop somewhere first
ham,r u saying i should re order the slippers cos i had to pay for returning it
ham,i know you are thinkin malaria but relax children cant handle malaria she would have been worse and its gastroenteritis if she takes enough to replace her loss her temp will reduce and if you give her malaria meds now she will just vomit its a self limiting illness she has which means in a few days it will completely stop
ham,cheers for the card is it that time of year already
ham,oh ok no prob
ham,i know a few people i can hit up and fuck to the yes
ham,u wake up already thanx e tau sar piah its quite nice
ham,please tell me you have some of that special stock you were talking about
ham,hey cutie how goes it here in wales its kinda ok there is like hills and shit but i still avent killed myself
ham,hello thanx for taking that call i got a job starts on monday
ham,jays getting really impatient and belligerent
ham,anything lar
ham,so pay first lar then when is da stock comin
ham,whos there say hi to our drugdealer
ham,wishing you and your family merry x mas and happy new year in advance
ham,lol ok ill try to send be warned sprint is dead slow youll prolly get it tomorrow
ham,sorry i missed your call can you please call back
ham,tick tick tick babe
ham,watching ajith film ah
ham,im really sorry i lit your hair on fire
ham,am on my way
ham,the xmas story is peace the xmas msg is love the xmas miracle is jesus hav a blessed month ahead amp wish u merry xmas
ham,where did u go my phone is gonna die you have to stay in here
ham,meeting u is my work tel me when shall i do my work tomorrow
ham,yes i started to send requests to make it but pain came back so im back in bed double coins at the factory too i gotta cash in all my nitros
ham,dont look back at the building because you have no coat and i dont want you to get more sick just hurry home and wear a coat to the gym
ham,yup im still having coffee wif my frens my fren drove shell give me a lift
ham,ok i asked for money how far
ham,only if you promise your getting out as soon as you can and youll text me in the morning to let me know you made it in ok
spam,upgrdcentre orange customer you may now claim your free camera phone upgrade for your loyalty call now on offer ends th july t cs apply opt out available
ham,k k good study well
spam,join the uks horniest dogging service and u can have sex nite just sign up and follow the instructions txt entry to now nyt ec a lp msg p
ham,ok lor i ned go toa payoh a while return smth u wan send me there or wat
spam,urgent your mobile number has been awarded with a prize guaranteed call from land line claim valid hrs only
spam,free tarot texts find out about your love life now try for free text chance to only after free msgs each
ham,alright im out have a good night
spam,text meet someone sexy today u can find a date or even flirt its up to u join just p reply with name age eg sam msg recd thirtyeight pence
ham,i ll hand her my phone to chat wit u
spam,you have an important customer service announcement call freephone now
spam,got what it takes take part in the wrc rally in oz u can with lucozade energy text rally le to p see packs or lucozade co uk wrc itcould be u
ham,hope things went well at doctors reminds me i still need go did u c d little thing i left in the lounge
ham,dont forget though that i love you and i walk beside you watching over you and keeping your heart warm
ham,velly good yes please
ham,sorry me going home first daddy come fetch later
ham,what about this one then
ham,i have had two more letters from i will copy them for you cos one has a message for you speak soon
ham,well shes in for a big surprise
ham,im just wondering what your doing right now
ham,we got a divorce lol she s here
ham,pls give her prometazine syrup mls then lt gt mins later feed
ham,k i didt see you k where are you now
ham,a bit of ur smile is my hppnss a drop of ur tear is my sorrow a part of ur heart is my life a heart like mine wil care for u forevr as my goodfriend
ham,that means get the door
ham,so are you guys asking that i get that slippers again or its gone with last year
ham,im in town now so ill jus take mrt down later
ham,lmao you know me so well
ham,stupid its not possible
ham,your dad is back in ph
ham,ill see if i can swing by in a bit got some things to take care of here firsg
ham,how do friends help us in problems they give the most stupid suggestion that lands us into another problem and helps us forgt the previous problem
ham,have you finished work yet
ham,baaaaaaaabe wake up i miss you i crave you i need you
spam,urgent your mobile number has been awarded with a bonus caller prize call from land line valid hrs only
ham,i wasnt well babe i have swollen glands at my throat what did you end up doing
ham,easy mate guess the quick drink was bit ambitious
ham,get ready for lt gt inches of pleasure
ham,yavnt tried yet and never played original either
ham,the gas station is like a block away from my house youll drive right by it since armenia ends at swann and you have to take howard
ham,dunno da next show aft is toa payoh got
ham,dear reached railway what happen to you
ham,bring tat cd don forget
ham,k wen ur free come to my home and also tel vikky i hav sent mail to him also better come evening il be free today aftr pm
ham,im at home n ready
ham,ok
ham,beerage
ham,shall i come to get pickle
ham,were gonna go get some tacos
ham,nite
ham,my supervisor find me one lor i thk his students i havent ask her yet tell u aft i ask her
spam,hi the sexychat girls are waiting for you to text them text now for a great night chatting send stop to stop this service
ham,oh kay on sat right
spam,urgent your costa del sol holiday or await collection call now toclaim sae tc s pobox stockport sk xh cost pm max mins
ham,no rushing im not working im in school so if we rush we go hungry
ham,your opinion about me over jada kusruthi lovable silent spl character not matured stylish simple pls reply
spam,our dating service has been asked contact u by someone shy call now all will be revealed pobox m uz p
ham,blank is blank but wat is blank lol
ham,oops sorry just to check that you dont mind picking me up tomo at half eight from station would that be ok
ham,come to me slave your doing it again going into your shell and unconsciously avoiding me you are making me unhappy
ham,im gonna say no sorry i would but as normal am starting to panic about time sorry again are you seeing on tuesday
ham,yup
ham,i miss you so much im so desparate i have recorded the message you left for me the other day and listen to it just to hear the sound of your voice i love you
ham,cool text me when youre ready
ham,hi dis is yijue i would be happy to work wif all for gek
ham,wot about on wed nite i am then but only til
ham,hmm my uncle just informed me that hes paying the school directly so pls buy food
ham,well theres not a lot of things happening in lindsay on new years sighs some bars in ptbo and the blue heron has something going
ham,was just about to ask will keep this one maybe thats why you didnt get all the messages we sent you on glo
ham,will have two more cartons off u and is very pleased with shelves
ham,okie
ham,me sef dey laugh you meanwhile hows my darling anjie
ham,still attending da talks
ham,cps is causing the outages to conserve energy
ham,watching cartoon listening music amp at eve had to go temple amp church what about u
ham,sad puppy noise
ham,er yep sure props
ham,i realise you are a busy guy and im trying not to be a bother i have to get some exams outta the way and then try the cars do have a gr day
spam,accordingly i repeat just text the word ok on your mobile phone and send
ham,what i mean was i left too early to check cos im working a
ham,hello just got here st andrews boy its a long way its cold i will keep you posted
spam,yes the only place in town to meet exciting adult singles is now in the uk txt chat to now p msg
ham,could you not read me my love i answered you
ham,i just cooked a rather nice salmon a la you
ham,thats cool princess i will cover your face in hot sticky cum
ham,so is there anything specific i should be doing with regards to jaklin or what because idk what the fuck
ham,change windows logoff sound
ham,hey for me there is no leave on friday wait i will ask my superior and tell you
ham,hey are we going for the lo lesson or gym
ham,ya very nice be ready on thursday
ham,idc get over here you are not weaseling your way out of this shit twice in a row
ham,but if she s drinkin im ok
ham,to the wonderful okors have a great month we cherish you guys and wish you well each day mojibiola
spam,urgent your mobile number has been awarded with a prize guaranteed call from land line claim valid hrs only ppm
ham,my superior telling that friday is leave for all other department except ours so it will be leave for you any way call waheed fathima hr and conform it
ham,sorry about that this is my mates phone and i didnt write it love kate
ham,so wats ur opinion abt him and how abt is character
ham,hello drivby quit edrunk sorry iff pthis makes no senrd dnot no how dancce drum n basq ihave fun nhite x ros xxxxxxx
ham,its good to hear from you
ham,the message sent is askin for lt gt dollars shoul i pay lt gt or lt gt
ham,painful words i thought being happy was the most toughest thing on earth but
ham,well i know z will take care of me so no worries
ham,ugh my leg hurts musta overdid it on mon
ham,dear we are going to our rubber place
ham,the beauty of life is in next second which hides thousands of secrets i wish every second will be wonderful in ur life gud n
ham,ummma will call after check in our life will begin from qatar so pls pray very hard
ham,i m reaching in another stops
ham,am going to take bath ill place the key in window
ham,im sorry bout last nite it wasn t ur fault it was me spouse it was pmt or sumthin u give me i think u shldxxxx
ham,hello good week fancy a drink or something later
ham,then get some cash together and ill text jason
ham,for real when u getting on yo i only need more tickets and one more jacket and im done i already used all my multis
ham,k k when are you going
ham,yup bathe liao
ham,good morning my dear have a great amp successful day
spam,you have won as a valued vodafone customer our computer has picked you to win a prize to collect is easy just call
ham,you also didnt get na hi hi hi hi hi
spam,no polyphonic tone ur mob every week just txt pt to st tone free so get txtin now and tell ur friends p tone reply hl info
spam,double mins and txts months free bluetooth on orange available on sony nokia motorola phones call mobileupd on or call optout n dx
ham,hey there glad u r better now i hear u treated urself to a digi cam is it good we r off at pm have a fab new year c u in coupla wks
ham,yep get with the program youre slacking
spam,talk sexy make new friends or fall in love in the worlds most discreet text dating service just text vip to and see who you could meet
spam,we tried to call you re your reply to our sms for a video mobile mins unlimited text free camcorder reply of call now
ham,does not operate after lt gt or what
ham,no idea i guess well work that out an hour after were supposed to leave since as usual nobody has any interest in figuring shit out before the last second
ham,will you like to be spoiled
ham,come lt n pass to me lar
ham,dhoni have luck to win some big title so we will win
ham,rose for red red for blood blood for heart heart for u but u for me send tis to all ur friends including me if u like me if u get back u r poor in relation u need some to support u r frnd many some luvs u some is praying god to marry u try it
ham,u should have made an appointment
ham,hey sexy buns have i told you i adore you loverboy i hope you remember to thank your sister in law for those meatballs grins i love you babe
ham,or u ask they all if next sat can a not if all of them can make it then im ok lor
ham,r comin back for dinner
ham,yup song bro no creative neva test quality he said check review online
ham,lets pool our money together and buy a bunch of lotto tickets if we win i get lt gt u get lt gt deal
ham,got hella gas money want to go on a grand nature adventure with galileo in a little bit
ham,im going orchard now laready me reaching soon u reaching
ham,hes in lag thats just the sad part but we keep in touch thanks to skype
ham,oh k why you got job then whats up
ham,send this to ur friends and receive something about ur voice how is my speaking expression childish naughty sentiment rowdy ful of attitude romantic shy attractive funny lt gt irritating lt gt lovable reply me
ham,morning only i can ok
ham,hi darlin its kate are u up for doin somethin tonight im going to a pub called the swan or something with my parents for one drink so phone me if u can
ham,k ill call you when im close
ham,umma my life and vava umma love you lot dear
ham,good afternoon my boytoy how are you feeling today better i hope are you being my good boy are you my obedient slave do you please your queen
spam,you have won a nokia i this is what you get when you win our free auction to take part send nokia to now hg suite lands row w jhl
ham,hello hello hi lou sorry it took so long reply i left mobile at friends in lancaster just got it bak neway im sorry i couldn t make ur b day hun
ham,short but cute be a good person
ham,i think i m waiting for the same bus inform me when you get there if you ever get there
ham,wait min stand at bus stop
spam,bought one ringtone and now getting texts costing pound offering more tones etc
ham,nite nite pocay wocay luv u more than n e thing eva i promise ring u morrowxxxx
ham,actually fuck that just do whatever do find an excuse to be in tampa at some point before january though
ham,i havent forgotten you i might have a couple bucks to send you tomorrow k i love ya too
ham,sounds better than my evening im just doing my costume im not sure what time i finish tomorrow but i will txt you at the end
ham,dont search love let love find u thats why its called falling in love bcoz u dont force yourself u just fall and u know there is smeone to hold u bslvyl
ham,is ur changes da report big cos ive already made changes da previous report
ham,k can that happen tonight
ham,jolly good by the way will give u tickets for sat eve speak before then x
ham,enjoy urself tmr
ham,ok i am a gentleman and will treat you with dignity and respect
spam,win we have a winner mr t foley won an ipod more exciting prizes soon so keep an eye on ur mobile or visit www win co uk
ham,no he joined today itself
spam,well done your costa del sol holiday or await collection call now toclaim sae tcs pobox stockport sk xh cost pm max mins
ham,what is important is that you prevent dehydration by giving her enough fluids
ham,lt gt great loxahatchee xmas tree burning update you can totally see stars here
spam,you have new message call
ham,nope think i will go for it on monday sorry i replied so late
ham,fyi im taking a quick shower be at epsilon in like lt gt min
ham,ok i am on the way to railway
ham,if i was i wasnt paying attention
ham,not thought bout it drink in tap spile at seven is that pub on gas st off broad st by canal ok
ham,what time you coming down later
ham,no dude its not fake my frnds got money thts y im reffering u if u member wit my mail link u vl be credited lt gt rs and il be getiing lt gt rs i can draw my acc wen it is lt gt rs
ham,no go no openings for that room til after thanksgiving without an upcharge
ham,i dont can you send it to me plus hows mode
ham,hope you are not scared
ham,if you hear a loud scream in about lt gt minutes its cause my gyno will be shoving things up me that dont belong
ham,did you show him and wot did he say or could u not c him dust
ham,i wish that i was with you holding you tightly making you see how important you are how much you mean to me how much i need you in my life
ham,yeah dont go to bed ill be back before midnight
ham,probably money worries things are coming due and i have several outstanding invoices for work i did two and three months ago
ham,looks like u wil b getting a headstart im leaving here bout ish but if u r desperate for my company i could head in earlier we were goin to meet in rummer
ham,for real tho this sucks i cant even cook my whole electricity is out and im hungry
spam,from lost help
spam,hmv bonus special pounds of genuine hmv vouchers to be won just answer easy questions play now send hmv to more info www percent real com
ham,do well all will for little time thing of good times ahead
spam,you have new message please call
ham,how much she payed suganya
