label,text
ham,im home my love if your still awake loving kiss
ham,you got job in wipro you will get every thing in life in or years
spam,free message thanks for using the auction subscription service p msgrcvd skip an auction txt out unsubscribe txt stop customercare
ham,wishing you and your family merry x mas and happy new year in advance
spam,mths half price orange line rental latest camera phones free had your phone mths call mobilesdirect free on to update now or stoptxt
ham,i have printed it oh so lt gt come upstairs
ham,yep by the pretty sculpture
ham,the length is e same but e top shorter n i got a fringe now i thk im not going liao too lazy dun wan distract u also
ham,mm yes dear look how i am hugging you both p
ham,love you aathi love u lot
ham,not getting anywhere with this damn job hunting over here
ham,thank you and by the way i just lost
ham,never blame a day in ur life good days give u happiness bad days give u experience both are essential in life all are gods blessings good morning
ham,ditto and you wont have to worry about me saying anything to you anymore like i said last night you do whatever you want and ill do the same peace
spam,congratulations ur awarded of cd vouchers or gift guaranteed free entry wkly draw txt music to tncs www ldew com win ppmx age
ham,my sis is catching e show in e afternoon so im not watching w her so c u wan watch today or tmr lor
spam,freemsg month unlimited free calls activate smartcall txt call to no subscriptn gbp wk unlimited calls help stop txt stop landlineonly
ham,im done oredi
ham,sent me ur email id soon
ham,ok then r we meeting later
ham,hey mate spoke to the mag people we re on the is deliver by the end of the month deliver on the th sept talk later
spam,urgent this is the nd attempt to contact u u have won call b t csbcm wc n xx callcost ppm mobilesvary max
ham,hey come online use msn we are all there
ham,me fine absolutly fine
ham,how much is blackberry bold in nigeria
ham,ok da i already planned i wil pick you
ham,fyi im at usf now swing by the room whenever
ham,no but well do medical missions to nigeria
spam,natalie f is inviting you to be her friend reply yes or no see her www sms ac u natalie k stop send stop frnd to
ham,yalru lyfu astne chikku bt innu mundhe lyf ali halla ke bilo marriage program edhae so lyf is nt yet ovr chikku ali vargu lyfu meow meow d
ham,very hurting n meaningful lines ever i compromised everything for my love
ham,yo we are watching a movie on netflix
ham,idea will soon get converted to live
ham,but your not here
ham,called dad oredi
ham,yep the great loxahatchee xmas tree burning of lt gt starts in an hour
spam,double mins and txts months free bluetooth on orange available on sony nokia motorola phones call mobileupd on or call optout n dx
ham,my mobile number pls sms ur mail id convey regards to achan amma rakhesh qatar
ham,i dont have i shall buy one dear
spam,eerie nokia tones u rply tone title to eg tone dracula to titles ghost addamsfa munsters exorcist twilight www getzed co uk pobox w wq p
ham,the sign of maturity is not when we start saying big things but actually it is when we start understanding small things have a nice evening bslvyl
ham,thk of wat to eat tonight
ham,babe i lost you will you try rebooting
spam,had your mobile months or more u r entitled to update to the latest colour mobiles with camera for free call the mobile update co free on
ham,u say leh of course nothing happen lar not say v romantic jus a bit only lor i thk e nite scenery not so nice leh
ham,hi my email address has changed now it is
ham,wat r u doing now
spam,you have received your mobile content enjoy
ham,wat makes some people dearer is not just de happiness dat u feel when u meet them but de pain u feel when u miss dem
ham,hi chikku send some nice msgs
ham,petey boy whereare you me and all your friendsare in thekingshead come down if you canlove nic
ham,i dont understand your message
spam,had your mobile months or more u r entitled to update to the latest colour mobiles with camera for free call the mobile update co free on
ham,can call me at to make sure dat ive woken up
ham,are we doing the norm tomorrow i finish just a cos of st tests need to sort library stuff out at some point tomo got letter from today access til end march so i better get move on
spam,private your account statement for shows unredeemed bonus points to claim call identifier code expires
ham,dont necessarily expect it to be done before you get back though because im just now headin out
ham,call me when you get the chance plz lt
ham,i was gonna ask you lol but i think its at
ham,hhahhaahahah rofl wtf nig was leonardo in your room or something
spam,u have a secret admirer reveal who thinks u r so special call to opt out reply reveal stop per msg recd cust care
ham,actually i deleted my old website now i m blogging at magicalsongs blogspot com
ham,go home liao ask dad to pick me up at
ham,u wake up already wat u doing u picking us up later rite im taking sq reaching ard smth like dat u can check e arrival time c ya soon
ham,once a fishrman woke early in d mrng it was very dark he waited a while amp found a sack ful of stones he strtd throwin thm in d sea pass time atlast he had jus stone sun rose up amp he found out tht those r nt stones those were diamonds moral dont wake up early in d mrng good night
ham,thats one of the issues but california is okay no snow so its manageable
ham,ever green quote ever told by jerry in cartoon a person who irritates u always is the one who loves u vry much but fails to express it gud nyt
ham,long after i quit i get on only like minutes a day as it is
ham,i am in tirupur da once you started from office call me
ham,k da how many page you want
ham,i think the other two still need to get cash but we can def be ready by
ham,my fri ah okie lor goin my drivin den go shoppin after tt
spam,thank you winner notified by sms good luck no future marketing reply stop to customer services
ham,wa u so efficient gee thanx
ham,this pay is lt decimal gt lakhs
ham,am in film ill call you later
spam,ur cash balance is currently pounds to maximize ur cash in now send cash to only p msg cc hg suite lands row w j hl
spam,youve won tkts to the euro cup final or cash to collect call b pobox ppm
ham,k wat s tht incident
ham,goodnight sleep well da please take care pa please
spam,okmail dear dave this is your final notice to collect your tenerife holiday or cash award call from landline tcs sae box cw wx ppm
spam,freemsg fancy a flirt reply date now join the uks fastest growing mobile dating service msgs rcvd just p to optout txt stop to reply date now
ham,ok the theory test when are going to book i think its on may coz thought wanna go out with jiayin but she isnt free
ham,hes really into skateboarding now despite the fact that he gets thrown off of it and winds up with bandages and shit all over his arms every five minutes
ham,shall i start from hear
ham,our ride equally uneventful not too many of those pesky cyclists around at that time of night
spam,cds u congratulations ur awarded of cd gift vouchers or gift guaranteed freeentry wkly draw xt music to tncs www ldew com win ppmx age
ham,dear umma she called me now
ham,not yet chikku going to room nw im in bus
ham,im job profile seems like bpo
ham,ummmmmaah many many happy returns of d day my dear sweet heart happy birthday dear
ham,aiyo cos i sms then neva reply so i wait to reply lar i tot havent finish ur lab wat
ham,are there ta jobs available let me know please cos i really need to start working
ham,not to worry im sure youll get it
ham,yeah we got one lined up for us
ham,two teams waiting for some players
ham,youve already got a flaky parent itsnot supposed to be the childs job to support the parent not until theyre the ride age anyway im supposed to be there to support you and now ive hurt you unintentional but hurt nonetheless
ham,i just made some payments so dont have that much sorry would you want it fedex or the other way
ham,i keep ten rs in my shelf buy two egg
ham,ok k sry i knw siva tats y i askd
ham,thank you i like you as well
spam,sunshine quiz wkly q win a top sony dvd player if u know which country the algarve is in txt ansr to sp tyrone
ham,oh all have to come ah
spam,p alfie moons children in need song on ur mob tell ur m s txt tone charity to for nokias or poly charity for polys zed profit charity
ham,but your brother transfered only lt gt lt gt pa
ham,oh dang i didnt mean o send that to you lol
ham,ill text now all creepy like so he wont think that we forgot
spam,congratulations in this weeks competition draw u have won the prize to claim just call b t cs stop sms over only ppm
ham,hey mr whats the name of that bill brison book the one about language and words
ham,yeh i am def up something sat
ham,don know i didt msg him recently
ham,howz that persons story
ham,storming msg wen u lift d phne u say hello do u knw wt is d real meaning of hello its d name of a girl yes and u knw who is dat girl margaret hello she is d girlfrnd f grahmbell who invnted telphone moral one can get d name of a person
ham,doesnt g have class early tomorrow and thus shouldnt be trying to smoke at lt gt
ham,just hopeing that wasn t too pissed up to remember and has gone off to his sisters or something
ham,si si i think ill go make those oreo truffles
ham,y she dun believe leh i tot i told her its true already i thk she muz c us tog then she believe
ham,wat u doing there
ham,im in office now da where are you
ham,im fine hope you are also
spam,your weekly cool mob tones are ready to download this weeks new tones include crazy frog axel f akon lonely black eyed dont p more info in n
spam,natalja f is inviting you to be her friend reply yes or no see her www sms ac u nat stop send stop frnd to
ham,i not free today i haf pick my parents up tonite
ham,just got to lt gt
ham,jordan got voted out last nite
ham,save yourself the stress if the person has a dorm account just send your account details and the money will be sent to you
ham,well the general price is lt gt oz let me know if when how much you want
ham,prabha im soryda realy frm heart im sory
ham,are you coming to day for class
ham,do all wan meet up n combine all the parts hows da rest of da project going
ham,im also came to room
ham,boy i love u grl hogolo boy gold chain kodstini grl agalla boy necklace madstini grl agalla boy hogli mutai eerulli kodthini grl i love u kano
ham,may i call you later pls
ham,sorry man accidentally left my phone on silent last night and didnt check it til i got up
ham,can you call me plz your number shows out of coveragd area i have urgnt call in vasai amp have to reach before o clock so call me plz
ham,captain is in our room
ham,at the latest gs still there if you can scrounge up some ammo and want to give the new ak a try
ham,y lei
ham,dear i have reache room
ham,yeah i imagine he would be really gentle unlike the other docs who treat their patients like turkeys
ham,i hate when she does this she turns what should be a fun shopping trip into an annoying day of how everything would look in her house
ham,oh k i think most of wi and nz players unsold
ham,im in a movie collect car oredi
ham,also wheres the piece
ham,good no swimsuit allowed
ham,k come to nordstrom when youre done
ham,damn can you make it tonight or do you want to just wait til tomorrow
ham,i got a call from a landline number i am asked to come to anna nagar i will go in the afternoon
ham,mm not entirely sure i understood that text but hey ho which weekend
ham,come to my home for one last time i wont do anything trust me
ham,now press conference da
ham,itll be tough but ill do what i have to
ham,huh so fast dat means u havent finished painting
ham,they said if its gonna snow it will start around or pm tonite they are predicting an inch of accumulation
ham,also remember to get dobbys bowl from your car
ham,maybe you should find something else to do instead
ham,y bishan lei i tot say lavender
ham,lol you wont feel bad when i use her money to take you out to a steak dinner d
ham,hey something came up last min think i wun be signing up tmr hee
ham,still got lessons in sch
ham,hi there we have now moved in our pub would be great c u if u cud come up
ham,he said that he had a right giggle when he saw u again you would possibly be the first person die from nvq but think how much you could for
ham,sad story of a man last week was my bday my wife didnt wish me my parents forgot n so did my kids i went to work even my colleagues did not wish as i entered my cabin my pa said happy bday boss i felt special she askd me lunch after lunch she invited me to her apartment we went there she said do u mind if i go into the bedroom for a minute ok i sed in a sexy mood she came out minuts latr wid a cake n my wife my parents my kidz my friends n my colleagues all screaming surprise and i was waiting on the sofa naked
ham,ok not sure what time tho as not sure if can get to library before class will try see you at some point have good eve
ham,i cant pick the phone right now pls send a message
ham,lol now im after that hot air balloon
ham,sorry da thangam its my mistake
ham,wats da model num of ur phone
spam,you have new message please call
ham,man this bus is so so so slow i think youre gonna get there before me
ham,not planned yet going to join company on jan only don know what will happen after that
spam,goldviking m is inviting you to be his friend reply yes or no see him www sms ac u goldviking stop send stop frnd to
ham,i know you are can you pls open the back
ham,have a lovely night and when you wake up to see this message i hope you smile knowing all is as should be have a great morning
ham,hi its me you are probably having too much fun to get this message but i thought id txt u cos im bored and james has been farting at me all night
ham,just arrived see you in a couple days lt
ham,book which lesson then you msg me i will call up after work or sth im going to get specs my membership is px
ham,ill probably be by tomorrow or even later tonight if somethings going on
ham,fwiw the reason im only around when its time to smoke is that because of gas i can only afford to be around when someone tells me to be and that apparently only happens when somebody wants to light up
ham,evry emotion dsnt hav words evry wish dsnt hav prayrs if u smile d world is wit u othrwise even d drop of tear dsnt lik stay wit u so b happy good morning keep smiling
ham,and pls pls drink plenty plenty water
ham,from here after the performance award is calculated every two month not for current one month period
ham,im at work please call
ham,hope this text meets you smiling if not then let this text give you a reason to smile have a beautiful day
spam,hot live fantasies call now just p per min ntt ltd po box croydon cr wb k
ham,keep ur problems in ur heart
ham,i am great how are you
ham,i knew it u slept v late yest wake up so late
ham,im fine hope you are good do take care
ham,what time should i tell my friend to be around
spam,urgent your mobile number won a bonus caller prize on this is the nd attempt to reach you call asap box n qp ppm
ham,was gr to see that message so when r u leaving congrats dear what school and wat r ur plans
ham,your board is working fine the issue of overheating is also reslove but still software inst is pending i will come around o clock
ham,oh ya got hip hop open haha i was thinking can go for jazz then zoom to cine actually tonight im free leh and theres a kb lesson tonight
ham,no need to say anything to me i know i am an outsider
ham,u definitely need a module from e humanities dis sem izzit u wan take other modules st
spam,freemsg hey im buffy and love to satisfy men home alone feeling randy reply c my pix qlynnbv help p a msg send stop to stop txts
ham,near kalainar tv office thenampet
ham,no no i will check all rooms befor activities
ham,ok ok ok then whats ur todays plan
ham,forgot it takes me years to shower sorry where you at your phone dead yet
ham,ma head dey swell oh thanks for making my day
ham,congrats kano whr s the treat maga
ham,yay finally lol i missed our cinema trip last week
ham,i dont knw pa i just drink milk
ham,mm so you asked me not to call radio
ham,sorry i cant take your call right now it so happens that there r waxsto do wat you want she can come and ill get her medical insurance and shell be able to deliver and have basic care im currently shopping for the right medical insurance for her so just give me til friday morning thats when i ll see the major person that can guide me to the right insurance
ham,exactly anyways how far is jide her to study or just visiting
ham,okies ill go yan jiu too we can skip ard oso go cine den go mrt one blah blah blah
ham,cheers u tex mecause u werebored yeah okden hunny r uin wk sat sound s likeyour havin gr fun j keep updat countinlots of loveme xxxxx
ham,i need to come home and give you some good lovin
ham,hmm bits and pieces lol sighs
ham,raviyog peripherals bhayandar east
spam,great new offer double mins double txt on best orange tariffs and get latest camera phones free call mobileupd free on now or stoptxt t cs
ham,he like not v shock leh cos telling shuhui is like telling leona also like dat almost all know liao he got ask me abt ur reaction lor
ham,wa ur openin sentence very formal anyway im fine too juz tt im eatin too much n puttin on weight haha so anythin special happened
spam,free entry into our weekly competition just text the word win to now t c www txttowin co uk
ham,apart from the one i told you about yesterday
ham,dear how you are you ok
ham,oh okie lor we go on sat
ham,mm umma ask vava also to come tell him can play later together
ham,if you r home then come down within min
ham,i will reach ur home in lt gt minutes
ham,you are sweet as well princess please tell me your likes and dislikes in bed
ham,when did you get to the library
spam,text get more ringtones logos and games from www txt com questions info txt co uk
ham,wot u up j
ham,good afternon my love how are today i hope your good and maybe have some interviews i wake and miss you babe a passionate kiss from across the sea
ham,yo you gonna still be in stock tomorrow today im trying to get a dubsack
ham,the guy kadeem hasnt been selling since the break i know one other guy but hes paranoid as fuck and doesnt like selling without me there and i cant be up there til late tonight
ham,no need lar i go engin cos my sis at arts today
ham,once free call me sir i am waiting for you
ham,ok c u then
ham,says the lt gt year old with a man and money im down to my last lt gt still waiting for that check
ham,are you this much buzy
ham,goodnight da thangam i really miss u dear
ham,somewhere out there beneath the pale moon light someone think in of u some where out there where dreams come true goodnite amp sweet dreams
ham,today is accept day u accept me as brother sister lover dear best clos lvblefrnd jstfrnd cutefrnd lifpartnr belovd swtheart bstfrnd no rply means enemy
ham,she s find i sent you an offline message to know how anjolas now
spam,dear voucher holder claim your st class airport lounge passes when using your holiday voucher call when booking quote st class x
ham,now im going for lunch
ham,nan sonathaya soladha why boss
ham,i am real baby i want to bring out your inner tigress
ham,i got like lt gt i can get some more later though get whatever you feel like
ham,superb thought be grateful that u dont have everything u want that means u still have an opportunity to be happier tomorrow than u are today
ham,yo sorry was in the shower sup
ham,ta daaaaa i am home babe are you still up
ham,ok thanx
ham,what today sunday sunday is holiday so no work
ham,hows my favourite person today r u workin hard couldnt sleep again last nite nearly rang u at
ham,nothing much chillin at home any super bowl plan
ham,dear regret i cudnt pick call drove down frm ctla now at cochin home left mobile in car ente style ishtamayoo happy bakrid
ham,thk some of em find wtc too far weiyi not goin e rest i dunno yet r ur goin dinner den i might b able to join
ham,hello my little party animal i just thought id buzz you as you were with your friends grins reminding you were loved and send a naughty adoring kiss
ham,dun b sad its over dun thk abt it already concentrate on ur other papers k
ham,old orchard near univ how about you
ham,k k its good when are you going
ham,ok leave no need to ask
ham,good night my dear sleepwell amp take care
ham,storming msg wen u lift d phne u say hello do u knw wt is d real meaning of hello its d name of a girl yes and u knw who is dat girl margaret hello she is d girlfrnd f grahmbell who invnted telphone moral one can get d name of a person
ham,what are youdoing later sar xxx
ham,no shit but i wasnt that surprised so i went and spent the evening with that french guy i met in town here and we fooled around a bit but i didnt let him fuck me
ham,please protect yourself from e threats sib never asks for sensitive information like passwords atm sms pin thru email never share your password with anybody
spam,urgent call from landline your complementary tenerife holiday or cash await collection sae t cs po box wa px ppm sender hol offer
spam,forwarded from free entry into our weekly comp just send the word enter to now t c www textcomp com
ham,im doing da intro covers energy trends n pros n cons brief description of nuclear fusion n oso brief history of iter n jet got abt n half pages
ham,hello how u doing what u been up when will u b moving out of the flat cos i will need to arrange to pick up the lamp etc take care hello caroline
ham,what u talking bout early morning its almost noon where your at
ham,hey next sun theres a basic yoga course at bugis we can go for that pilates intro next sat tell me what time you r free
ham,you see the requirements please
ham,i really need kiss u i miss u my baby from ur baby eva
ham,good evening this is roger how are you
ham,gud ni swt drms take care
ham,lol or i could just starve and lose a pound by the end of the day
ham,i dont run away frm u i walk slowly amp it kills me that u dont care enough to stop me
ham,r going todays meeting
ham,k k this month kotees birthday know
ham,hi petey noi m ok just wanted chat coz avent spoken u a long time hope ur doin alrite have good nit at js love ya am x
ham,okay we wait ah
ham,send ur birthdate with month and year i will tel u ur life partners name and the method of calculation reply must
ham,sorry in meeting ill call you later
ham,hi darlin im missin u hope you are having a good time when are u back and what time if u can give me a call at home jess xx
ham,huh so early then having dinner outside izzit
ham,take some small dose tablet for fever
ham,reverse is cheating that is not mathematics
ham,was the actual exam harder than nbme
ham,reverse is cheating that is not mathematics
ham,happy new year hope you are having a good semester
spam,mila age blonde new in uk i look sex with uk guys if u like fun with me text mtalk to pp txt st free increments help
ham,whos this am in class
ham,aiyo u always c our ex one i dunno abt mei she haven reply first time u reply so fast y so lucky not workin huh got bao by ur sugardad ah gee
ham,are you going to wipro interview today
ham,lol ok your forgiven
ham,wat time r going to xins hostel
ham,can u get pic msgs to your phone
ham,dunno cos i was v late n when i reach they inside already but we ate spageddies lor its e gals who r laughing at me lor
ham,i dunno they close oredi not v ma fan
ham,jus finished avatar nigro
ham,that said can you text him one more time
ham,babe i miiiiiiissssssssss you i need you i crave you geeee im so sad without you babe i love you
spam,you are a winner u have been specially selected receive or a holiday flights inc speak to a live operator claim p min
ham,yes i will be there glad you made it
ham,guai shd haf seen him when hes naughty so free today can go jogging
spam,promotion number ur awarded a city break and could win a summer shopping spree every wk txt store to skilgme tscs winawk age perwksub
spam,u have a secret admirer reveal who thinks u r so special call to opt out reply reveal stop per msg recd cust care
spam,private your account statement for shows unredeemed bonus points to claim call identifier code expires
ham,u wan haf lunch im in da canteen now
ham,dear sir salam alaikkum pride and pleasure meeting you today at the tea shop we are pleased to send you our contact number at qatar rakhesh an indian pls save our number respectful regards
ham,vikky come around lt time gt
ham,me n him so funny
ham,much better now thanks lol
ham,i like dis sweater fr mango but no more my size already so irritating
ham,lol i would but despite these cramps i like being a girl
ham,hi im having the most relaxing time ever we have to get up at am every day was the party good the other night i get home tomorrow at ish
ham,are you in castor you need to see something
ham,lol oops sorry have fun
ham,nah i dont think he goes to usf he lives around here though
ham,pls send me the correct name da
ham,u coming pick me
ham,do you know when dad will be back
ham,no drama pls i have had enough from you and family while i am struggling in the hot sun in a strange place no reason why there should be an ego of not going if not invited when actually its necessity to go wait for very serious reppurcussions
ham,company is very good environment is terrific and food is really nice
ham,no but we found a diff farm shop to buy some cheese on way back now can i call in
ham,g wants to know where the fuck you are
ham,sen told that he is going to join his uncle finance in cbe
ham,sorry about earlier putting out fires are you around to talk after or do you actually have a life lol
ham,im not driving raining then ill get caught at e mrt station lor
ham,so u gonna get deus ex
ham,nope i waiting in sch daddy
ham,does uncle timi help in clearing cars
ham,did you stitch his trouser
