label,text
ham,sir i have been late in paying rent for the past few months and had to pay a lt gt charge i felt it would be inconsiderate of me to nag about something you give at great cost to yourself and thats why i didnt speak up i however am in a recession and wont be able to pay the charge this month hence my askin well ahead of months end can you please help thanks
ham,this is my number by vivek
ham,k k how much does it cost
ham,no but the bluray player can
ham,i cant keep going through this it was never my intention to run you out but if you choose to do that rather than keep the room clean so i dont have to say no to visitors then maybe thats the best choice yes i wanted you to be embarassed so maybe youd feel for once how i feel when i have a friend who wants to drop buy and i have to say no as happened this morning ive tried everything i dont know what else to do
ham,yes princess i want to please you every night your wish is my command
ham,lolnice i went from a fish to water
spam,themob hit the link to get a premium pink panther game the new no from sugababes a crazy zebra animation or a badass hoody wallpaper all free
ham,thanx yup we coming back on sun finish dinner going back hotel now time flies were tog exactly a mth today hope well haf many more mths to come
ham,i guess thats why you re worried you must know that theres a way the body repairs itself and im quite sure you shouldnt worry well take it slow first the tests they will guide when your ovulation is then just relax nothing youve said is a reason to worry but i ll keep on followin you up
spam,this is the nd time we have tried contact u u have won the pound prize claim is easy call now only p per min bt national rate
ham,pls pls find out from aunt nike
spam,tone club your subs has now expired re sub reply monoc monos or polyc polys weekly p per week txt stop stop this msg free stream
spam,this is the nd time we have tried to contact u u have won the prize claim is easy just call now only p per minute bt national rate
ham,what happened to our yo date
ham,no probs hon how u doinat the mo
ham,tell dear what happen to you why you talking to me like an alian
spam,thanks for your ringtone order reference t you will be charged gbp per week you can unsubscribe at anytime by calling customer services on
spam,you are chosen to receive a award pls call claim number to collect your award which you are selected to receive as a valued mobile customer
ham,i will reach before ten morning
ham,saw guys and dolls last night with patrick swayze it was great
ham,better made up for friday and stuffed myself like a pig yesterday now i feel bleh but at least its not writhing pain kind of bleh
ham,so when do you wanna gym
ham,yar lor how u noe u used dat route too
ham,oh ho is this the first time u use these type of words
ham,depends on where u going lor
ham,i will once i get home
spam,do you want a new nokia i colour phone delivered tomorrow with free minutes to any mobile free text free camcorder reply or call
ham,just glad to be talking to you
ham,havent stuck at orchard in my dads car going dinner now u leh so r they free tonight
ham,excellent wish we were together right now
ham,surly ill give it to you while coming to review
spam,eerie nokia tones u rply tone title to eg tone dracula to titles ghost addamsfa munsters exorcist twilight www getzed co uk pobox w wq p
ham,yeah right ill bring my tape measure fri
ham,jay says that youre a double faggot
ham,oh ho is this the first time u use these type of words
ham,yeah in fact he just asked if we needed anything like an hour ago when and how much
ham,the guy did some bitching but i acted like id be interested in buying something else next week and he gave it to us for free
ham,sweetheart hope you are not having that kind of day have one with loads of reasons to smile biola
ham,tee hee off to lecture cheery bye bye
ham,hello handsome are you finding that job not being lazy working towards getting back that net for mummy wheres my boytoy now does he miss me
ham,r we still meeting dinner tonight
ham,how come guoyang go n tell her then u told her
ham,wrong phone this phone i answer this one but assume the other is people i dont well
ham,that one week leave i put know that time why
ham,wonders in my world th you th ur style th ur smile th ur personality rd ur nature nd ur sms and st ur lovely friendship good morning dear
ham,ya going for restaurant
ham,how are you doing hows the queen are you going for the royal wedding
ham,er yeah i will b there at sorry just tell me which pub cafe to sit in and come wen u can
ham,can dunno wat to get her
spam,you have won a nokia i this is what you get when you win our free auction to take part send nokia to now hg suite lands row w jhl
ham,nothing lor a bit bored too then y dun u go home early sleep today
ham,hi neva worry bout da truth coz the truth will lead me ur heart it s the least a unique person like u deserve sleep tight or morning
spam,network operator the service is free for t cs visit biz
ham,lol well dont do it without me we could have a big sale together
ham,sir i am waiting for your call once free please call me
ham,what i meant to say is cant wait to see u again getting bored of this bridgwater banter
ham,whats nannys address
spam,hard live chat just p min choose your girl and connect live call now cheap chat uks biggest live service vu bcm wc n xx
spam,hot live fantasies call now just p per min ntt ltd po box croydon cr wb is a national rate call
ham,haha can but im having dinner with my cousin
ham,sorry i now then c ur msg yar lor so poor thing but only one night tmr ull have a brand new room sleep in
spam,u are subscribed to the best mobile content service in the uk for per ten days until you send stop to helpline
ham,hi baby ive just got back from work and i was wanting to see u allday i hope i didnt piss u off on the phone today if u are up give me a call xxx
ham,this is wishing you a great day moji told me about your offer and as always i was speechless you offer so easily to go to great lengths on my behalf and its stunning my exam is next friday after that i will keep in touch more sorry
ham,i cant pick the phone right now pls send a message
ham,sorry for the delay yes masters
ham,haha hope can hear the receipt sound gd luck
ham,none of thats happening til you get here though
ham,that is wondarfull song
ham,well good morning mr hows london treatin ya treacle
ham,no im in the same boat still here at my moms check me out on yo im half naked
spam,customer service annoncement you have a new years delivery waiting for you please call now to arrange delivery
ham,do not b late love mum
ham,sorry in meeting ill call later
ham,no problem we will be spending a lot of quality time together
ham,sez hows u de arab boy hope u r all good give my love evry love ya eshxxxxxxxxxxx
ham,i wonder if your phone battery went dead i had to tell you i love you babe
ham,today is sorry day if ever i was angry with you if ever i misbehaved or hurt you plz plz just slap urself bcoz its ur fault im basically good
ham,i want to send something that can sell fast lt gt k is not easy money
spam,had your mobile mths update for free to oranges latest colour camera mobiles unlimited weekend calls call mobile upd on freefone or stoptxt
ham,alright took the morphine back in yo
ham,hey hey werethe monkeespeople say we monkeyaround howdy gorgeous
ham,just making dinner you
ham,realy sorry i dont recognise this number and am now confused who r u please
ham,k go and sleep well take rest
ham,happy new year princess
ham,im gonna rip out my uterus
ham,hi its in durban are you still on this number
ham,ive not sent it he can send me
spam,think ur smart win this week in our weekly quiz text play to now t cs winnersclub po box m uz gbp week
ham,sure but since my parents will be working on tuesday i dont really need a cover story
ham,wait lt gt min
ham,then mums repent how
ham,for the first time in the history need comfort and luxury are sold at same price in india onion rs lt gt petrol rs lt gt beer rs lt gt shesil lt gt
ham,ill be at yours in about mins but look out for me
ham,hi darlin ive just got back and i had a really nice night and thanks so much for the lift see u tomorrow xxx
ham,thanks for loving me so you rock
ham,same im at my great aunts anniversary party in tarpon springs
ham,jos ask if u wana meet up
ham,aww you must be nearly dead well jez iscoming over todo some workand that whilltake forever
ham,ah poop looks like ill prob have to send in my laptop to get fixed cuz it has a gpu problem
ham,okay same with me well thanks for the clarification
ham,ok very good its all about making that money
ham,pls dont restrict her from eating anythin she likes for the next two days
spam,call from tells u call to claim prize u have enter all ur mobile personal details the prompts careful
ham,i wanted to ask to wait me to finish lect cos my lect finishes in an hour anyway
ham,youve always been the brainy one
ham,by monday next week give me the full gist
spam,you can stop further club tones by replying stop mix see my tone com enjoy html for terms club tones cost gbp week mfl
ham,its like that hotel dusk game i think you solve puzzles in a area thing
spam,uve been selected to stay in of top british hotels for nothing holiday valued at dial to claim national rate call bx sw ss
ham,hey sorry i didntgive ya a a bellearlier hunny
ham,i cant right this second gotta hit people up first
ham,haha awesome i might need to take you up on that what you doin tonight
ham,babe im answering you cant you see me maybe youd better reboot ym i got the photo its great
ham,aight well head out in a few
ham,carlos took a while again we leave in a minute
ham,in da car park
spam,hi babe its jordan how r u im home from abroad and lonely text me back if u wanna chat xxsp visionsms com text stop to stopcost p
ham,you still at the game
ham,yar lor he wan go c horse racing today mah so eat earlier lor i ate chicken rice u
ham,ive been searching for the right words to thank you for this breather i promise i wont take your help for granted and will fulfil my promise you have been wonderful and a blessing at all times
ham,ugh its been a long day im exhausted just want to cuddle up and take a nap
ham,ok but bag again
ham,i am taking half day leave bec i am not well
ham,just curious because my cuz asked what i was up to
spam,you are guaranteed the latest nokia phone a gb ipod mp player or a prize txt word collect to no ibhltd ldnw h p mtmsgrcvd
ham,thats y u haf keep me busy
ham,message some text missing sender name missing number missing sent date missing missing u a lot thats y everything is missing sent via fullonsms com
spam,dear voucher holder to claim this weeks offer at your pc please go to http www wtlp co uk text ts cs apply
ham,cool what time you think you can get here
ham,what i told before i tell stupid hear after i wont tell anything to you you dad called to my brother and spoken not with me
ham,i hope your pee burns tonite
ham,aight yo dats straight dogg
ham,dizzamn aight ill ask my suitemates when i get back
ham,that call cost which i guess isnt bad miss ya need ya want ya love ya
ham,sir i am waiting for your mail
ham,thats good lets thank god please complete the drug have lots of water and have a beautiful day
ham,ranjith cal drpd deeraj and deepak min hold
ham,what is the plural of the noun research
ham,when where do i pick you up
ham,from someone not to smoke when every time ive smoked in the last two weeks is because of you calling or texting me that you wanted to smoke
ham,actually i decided i was too hungry so i havent left yet v
ham,i love your ass do you enjoy doggy style
ham,yeah i dont see why not
ham,today is accept day u accept me as brother sister lover dear best clos lvblefrnd jstfrnd cutefrnd lifpartnr belovd swtheart bstfrnd no rply means enemy
ham,what do you do my dog must i always wait till the end of your day to have word from you did you run out of time on your cell already
ham,when i have stuff to sell i ll tell you
ham,yes but i dont care cause i know its there
ham,sure if i get an acknowledgement from you that its astoundingly tactless and generally faggy to demand a blood oath fo
ham,in fact when do you leave i think addie goes back to school tues or wed
ham,life spend with someone for a lifetime may be meaningless but a few moments spent with someone who really love you means more than life itself
ham,hurt me tease me make me cry but in the end of my life when i die plz keep one rose on my grave and say stupid i miss u have a nice day bslvyl
ham,shit babe thasa bit messed up yeh
ham,then u ask darren go n pick u lor but i oso sian tmr haf meet lect
ham,what makes you most happy
ham,dont give a monkeys wot they think and i certainly dont mind any friend of mine all that just dont sleep wiv that wud be annoyin
spam,dear voucher holder claim this weeks offer at your pc go to http www e tlp co uk expressoffer ts cs apply stop texts txt stop to
ham,good morning princess have a great day
ham,hmmm guess we can go kb n power yoga haha dunno we can tahan power yoga anot thk got lo oso forgot liao
ham,by march ending i should be ready but will call you for sure the problem is that my capital never complete how far with you hows work and the ladies
ham,yeah i can still give you a ride
ham,my exam is for february wish you a great day
ham,any pain on urination any thing else
spam,in the simpsons movie released in july name the band that died at the start of the film a green day b blue day c red day send a b or c
ham,thanks a lot for your wishes on my birthday thanks you for making my birthday truly memorable
ham,your bill at is so thats not bad
ham,a swt thought nver get tired of doing little things lovable persons coz somtimes those little things occupy d biggest part in their hearts gud ni
ham,can i please come up now imin town dontmatter if urgoin outl r
ham,no promises on when though havent even gotten dinner yet
ham,ela kano il download come wen ur free
ham,thanx the time we ve spent geva its bin mint ur my baby and all i want is u xxxx
ham,am okay will soon be over all the best
ham,nope wif my sis lor aft bathing my dog then i can bathe looks like its going rain soon
ham,havent still waitin as usual come back sch oredi
spam,congrats nokia video camera phone is your call calls cost ppm ave call mins vary from mobiles close post bcm ldn wc n xx
ham,no da vijay going to talk in jaya tv
ham,nothing really just making sure everybodys up to speed
ham,no i dont have cancer moms making a big deal out of a regular checkup aka pap smear
spam,goal arsenal henry v liverpool henry scores with a simple shot from yards from a pass by bergkamp to give arsenal a goal margin after mins
ham,oh ic i thought you meant mary jane
ham,ha both of us doing e same thing but i got tv watch u can thk of where go tonight or u already haf smth in mind
ham,how are you its been ages hows abj
ham,cold dont be sad dear
ham,ok lar joking wif u oni
ham,y wan to go there c doctor
ham,hi dear we saw dear we both are happy where you my battery is low
ham,thats cool i want to please you
ham,nah im goin the wrks with j wot bout u
ham,then dun wear jeans lor
ham,o we cant see if we can join denis and mina or does denis want alone time
ham,im working technical support voice process
ham,tacos rajas burrito right
ham,if you text on your way to cup stop that should work and that should be bus
ham,s s first time dhoni rocks
ham,many times we lose our best ones bcoz we are
spam,you have been specially selected to receive a pound award call before the lines close cost ppm t cs apply ag promo
ham,mmmmm it was sooooo good to wake to your words this morning my love mmmm fuck i love you too my lion devouring kiss from across the sea
ham,sorry man my stash ran dry last night and i cant pick up more until sunday
ham,hmm ok ill stay for like an hour cos my eye is really sore
ham,hey ive booked the pilates and yoga lesson already haha
ham,it is a good thing im now getting the connection to bw
ham,then she dun believe wat
ham,no to be nosy i guess idk am i over reacting if im freaked
ham,awesome think we can get an th at usf some time tonight
ham,k ill work something out
ham,yup how noe leh
ham,happy new year my dear brother i really do miss you just got your number and decided to send you this text wishing you only happiness abiola
ham,jay is snickering and tells me that x is totally fucking up the chords as we speak
ham,i hope you arnt pissed off but id would really like to see you tomorrow love me xxxxxxxxxxxxxx
ham,im still looking for a car to buy and have not gone the driving test yet
ham,i can send you a pic if you like
ham,shes fine good to hear from you how are you my dear happy new year oh
ham,geeeee your internet is really bad today eh
ham,yo you around a friend of mines lookin to pick up later tonight
spam,as one of our registered subscribers u can enter the draw a g b gift voucher by replying with enter to unsubscribe text stop
ham,whatever im pretty pissed off
ham,i place all ur points on e cultures module already
ham,i didnt get anything da
ham,shes fine sends her greetings
ham,kind of just missed train cos of asthma attack nxt one in half hr so driving in not sure where to park
ham,miles and smiles r made frm same letters but do u know d difference smile on ur face keeps me happy even though i am miles away from u keep smiling good nyt
ham,crazy ar hes married like gd looking guys not me my frens like say hes korean leonas fave but i dun thk he is aft some thinking mayb most prob ill go
ham,ambrith madurai met u in arun dha marrge remembr
ham,usf i guess might as well take car
spam,oh my god ive found your number again im so glad text me back xafter this msgs cst std ntwk chg
ham,finished class where are you
ham,that sucks ill go over so u can do my hair youll do it free right
spam,twinks bears scallies skins and jocks are calling now dont miss the weekends fun call at p min stop texts call nat rate
ham,you can never do nothing
ham,pick you up bout ish what time are and that going
ham,my ex wife was not able to have kids do you want kids one day
ham,i dont know same thing thats wrong everyso often he panicks starts goin on bout not bein good enough
ham,yeh indians was nice tho it did kane me off a bit he he we shud go out a drink sometime soon mite hav go da works a laugh soon love pete x x
ham,aight text me tonight and well see whats up
ham,yup but not studying surfing lor im in e lazy mode today
ham,just buy a pizza meat lovers or supreme u get to pick
spam,for the most sparkling shopping breaks from per person call or visit www shortbreaks org uk
ham,future is not what we planned for tomorrow it is the result of what we do today do the best in present enjoy the future
ham,ew are you one of them
ham,no its not pride im almost lt gt years old and shouldnt be takin money from my kid youre not supposed to have to deal with this stuff this is grownup stuff why i dont tell you
ham,gran onlyfound out afew days ago cusoon honi
ham,i have lost kilos as of today
ham,but thats on ebay it might be less elsewhere
spam,hi ibh customer loyalty offer the new nokia mobile from only at txtauction txt word start to no get yours now t
ham,watching tv now i got new job
ham,we have sent jd for customer service cum accounts executive to ur mail id for details contact us
ham,did u turn on the heater the heater was on and set to lt gt degrees
ham,ure welcome caught u using broken english again
ham,ok me watching tv too
ham,rose for red red for blood blood for heart heart for u but u for me send tis to all ur friends including me if u like me if u get back u r poor in relation u need some to support u r frnd many some luvs u some is praying god to marry u try it
spam,todays offer claim ur worth of discount vouchers text yes to now savamob member offers mobile t cs sub unsub reply x
ham,nope but ill b going sch on fri quite early lor cos mys sis got paper in da morn
ham,right on brah see you later
ham,my sister in law hope you are having a great month just saying hey abiola
ham,its too late but its k wish you the same
ham,me babe i feel the same lets just get about it both try cheer up not fit soo muchxxlove u locaxx
ham,are you available for soiree on june rd
spam,for ur chance to win a wkly shopping spree txt shop to ts cs www txt shop com custcare x p wk
ham,usually the person is unconscious thats in children but in adults they may just behave abnormally i ll call you now
ham,k must book a not huh so going for yoga basic on sunday
ham,stupid its not possible
ham,its ok i wun b angry msg u aft i come home tonight
ham,jus telling u dat ill b leaving shanghai on st instead so well haf more time meet up cya
ham,depends on individual lor e hair dresser say pretty but my parents say look gong u kaypoh i also dunno wat she collecting
ham,aah bless hows your arm
ham,now whats your house again and do you have any beer there
ham,all e best ur driving tmr
ham,y where u at dogbreath its just sounding like jan c that s al
ham,yup hey then one day on fri we can ask miwa and jiayin take leave go karaoke
ham,say this slowly god i love you amp i need you clean my heart with your blood send this to ten special people amp u c miracle tomorrow do it pls pls do it
ham,sorry ill call later in meeting any thing related to trade please call arul lt gt
ham,yes princess toledo
ham,jay told me already will do
ham,what time you think youll have it need to know when i should be near campus
ham,i was just callin to say hi take care bruv
ham,hi hope u r both ok he said he would text and he hasnt have u seen him let me down gently please
ham,anyway many good evenings to u s
ham,hiya do u like the hlday pics looked horrible in them so took mo out hows the camp amrca thing speak soon serena
ham,yun ah the ubi one say if wan call by tomorrow call look for irene ere only got bus ubi cres ubi tech park ph for st wkg days n
ham,good good billy mates all gone just been jogging again did enjoy concert
ham,ok i ll do you right later
ham,gokila is talking with you aha
ham,dear friends sorry for the late information today is the birthday of our loving ar praveesh for more details log on to face book and see its his number lt gt dont miss a delicious treat
ham,sry da jst nw only i came to home
ham,olol i printed out a forum post by a guy with the exact same prob which was fixed with a gpu replacement hopefully they dont ignore that
ham,havent shopping now lor i juz arrive only
ham,haha yup hopefully we will lose a few kg by mon after hip hop can go orchard and weigh again
ham,so wats da decision
ham,no gifts you trying to get me to throw myself off a cliff or something
ham,oh wow thats gay will firmware update help
ham,wat time u finish ur lect today
ham,i like to talk pa but am not able to i dont know y
ham,cool we shall go and see have to go to tip anyway are you at home got something to drop in later so lets go to town tonight maybe mum can take us in
ham,that seems unnecessarily hostile
ham,s no competition for him
ham,oh unintentionally not bad timing great fingers the trains play along will give fifteen min warning
ham,stupid its not possible
ham,ok lor im in town now lei
ham,k my roommate also wants a dubsack and another friend may also want some so plan on bringing extra ill tell you when they know for sure
ham,yup
ham,they released vday shirts and when u put it on it makes your bottom half naked instead of those white underwear
ham,did you get any gift this year i didnt get anything so bad
ham,hey dont forget you are mine for me my possession my property mmm childish smile
spam,all the lastest from stereophonics marley dizzee racal libertines and the strokes win nookii games with flirt click themob wap bookmark or text wap to
ham,im back amp were packing the car now ill let you know if theres room
ham,ok
spam,guess who am i this is the first time i created a web page www asjesus com read all i wrote im waiting for your opinions i want to be your friend
spam,urgent ur guaranteed award is still unclaimed call now closingdate claimcode m m pmmorefrommobile bremoved mobypobox ls yf
ham,buzz hey my love i think of you and hope your day goes well did you sleep in i miss you babe i long for the moment we are together again loving smile
ham,yeah i think my usual guys still passed out from last night if you get ahold of anybody let me know and ill throw down
ham,every king was once a crying baby and every great building was once a map not imprtant where u r today but where u wil reach tomorw gud ni
ham,r we going with the lt gt bus
ham,miss call miss call khelate kintu opponenter miss call dhorte lage thats d rule one with great phone receiving quality wins
ham,i m going to try for months ha ha only joking
ham,derp which is worse a dude who always wants to party or a dude who files a complaint about the three drug abusers he lives with
ham,gibbs unsold mike hussey
ham,when people see my msgs they think iam addicted to msging they are wrong bcoz they don t know that iam addicted to my sweet friends bslvyl
ham,today am going to college so am not able to atten the class
ham,im in inperialmusic listening the weirdest track ever by leafcutter john sounds like insects being molested someone plumbing remixed by evil men on acid
ham,lol no just trying to make your day a little more interesting
ham,awesome ill see you in a bit
ham,moji i love you more than words have a rich day
ham,hello which the site to download songs its urgent pls
ham,your pussy is perfect
ham,do you know where my lab goggles went
ham,dad went out oredi
spam,do you want a new video handset anytime any network mins half price line rental camcorder reply or call for delivery tomorrow
ham,horrible gal me in sch doing some stuff how come u got mc
spam,xmas new years eve tickets are now on sale from the club during the day from am till pm and on thurs fri sat night this week theyre selling fast
