label,text
ham,sun ah thk mayb can if dun have anythin on thk have to book e lesson e pilates is at orchard mrt u noe hor
ham,prepare to be pounded every night
ham,pete is this your phone still its jenny from college and leanne what are you up to now
ham,dad wanted to talk about the apartment so i got a late start omw now
ham,am up to my eyes in philosophy
ham,not sure yet still trying to get a hold of him
ham,alright see you in a bit
ham,i need an th but im off campus atm could i pick up in an hour or two
spam,you are a winner you have been specially selected to receive cash or a award speak to a live operator to claim call am pm cost p
ham,mean its confirmed i tot they juz say oni ok then
ham,becoz its lt gt jan whn al the post ofice is in holiday so she cn go fr the post ofice got it duffer
ham,oh baby of the house how come you dont have any new pictures on facebook
ham,whats that coming over the hill is it a monster hope you have a great day things r going fine here busy though
ham,at the funeral home with audrey and dad
spam,urgent this is the nd attempt to contact u u have won call b t csbcm wc n xx callcost ppmmobilesvary max
ham,if i get there before you after your ten billion calls and texts so help me god
ham,i dun believe u i thk u told him
ham,is ur paper in e morn or aft tmr
ham,er
ham,yes i trust u to buy new stuff asap so i can try it out
ham,oh god im gonna google nearby cliffs now
ham,what are you doing in langport sorry but ill probably be in bed by pm it sucks being ill at xmas when do you and go sri lanka
ham,white fudge oreos are in stores
ham,i cant pick the phone right now pls send a message
ham,i thk gotta go home by urself cos ill b going out shopping my frens present
ham,yes princess i want to make you happy
ham,i thk u dun haf hint in e forum already lor cos i told ron n darren is going tell shuhui
ham,good morning my dear have a great amp successful day
ham,im an actor when i work i work in the evening and sleep late since im unemployed at the moment i always sleep late when youre unemployed every day is saturday
spam,youll not rcv any more msgs from the chat svc for free hardcore services text go to if u get nothing u must age verify with yr network try again
ham,need a coffee run tomo cant believe its that time of week already
ham,good sleep is about rhythm the person has to establish a rhythm that the body will learn and use if you want to know more
ham,lt gt am i think should say on syllabus
ham,hey leave it not a big deal take care
spam,you have new message please call
ham,we are at grandmas oh dear u still ill i felt shit this morning but i think i am just hungover another night then we leave on sat
ham,i ll get there tomorrow and send it to you
spam,six chances to win cash from to pounds txt csh and send to cost p day days tsandcs apply reply hl info
ham,house maid is the murderer coz the man was murdered on lt gt th january as public holiday all govt instituitions are closed including post office understand
ham,takin linear algebra today
ham,you have registered sinco as payee log in at icicibank com and enter urn lt gt to confirm beware of frauds do not share or disclose urn to anyone
ham,mmmmm i loved waking to your words this morning i miss you too my love i hope your day goes well and you are happy i wait for us to be together again
ham,yup izzit still raining heavily cos im in e mrt i cant c outside
ham,r u over scratching it
ham,lol they dont know about my awesome phone i could click delete right now if i want
ham,celebrate my b day y else
ham,im not sure if its still available though
ham,cool ill text you when im on the way
ham,well join the lt gt bus
ham,tell where you reached
ham,thats cool i am a gentleman and will treat you with dignity and respect
spam,orange customer you may now claim your free camera phone upgrade for your loyalty call now on offer ends thmarch t cs apply opt out availa
ham,thanx puttin da fone down on me
ham,dont flatter yourself tell that man of mine two pints of carlin in ten minutes please
ham,she was supposed to be but couldnt make it shes still in town though
ham,dunno lei i might b eatin wif my frens if wan to eat then i wait lar
spam,buy space invaders a chance win orig arcade game console press for games arcade std wap charge see o co uk games terms settings no purchase
ham,nice talking to you please dont forget my pix i want to see all of you
ham,yes when is the appt again
ham,hello damn this christmas thing i think i have decided to keep this mp that doesnt work
ham,my computer just fried the only essential part we dont keep spares of because my fucking idiot roommates looovvve leaving the thing running on full lt gt
ham,thts gods gift for birds as humans hav some natural gift frm god
ham,awww dat is sweet we can think of something to do he he have a nice time tonight ill probably txt u later cos im lonely xxx
ham,my love how come it took you so long to leave for zahers i got your words on ym and was happy to see them but was sad you had left i miss you
ham,hiya had a good day have you spoken to since the weekend
ham,ok so april cant wait
ham,jane babes not goin wrk feel ill after lst nite foned in already cover me chuck
ham,am also doing in cbe only but have to pay
ham,lets use it next week princess
ham,i wait inside da car park
ham,im outside islands head towards hard rock and youll run into me
ham,my sister going to earn more than me da
ham,wonders in my world th you th ur style th ur smile th ur personality rd ur nature nd ur sms and st ur lovely friendship good morning dear
ham,oic i saw him too but i tot he din c me i found a group liao
ham,i love you both too
spam,gr poly tones all mobs direct u rply with poly title to eg poly breathe titles crazyin sleepingwith finest ymca getzed co uk pobox o w wq p
spam,your chance to be on a reality fantasy show call now just p per min ntt ltd po box croydon cr wb is a national rate call
ham,hahaha use your brain dear
ham,hiya comin bristol st week in april les got off rudi on new yrs eve but i was snoring they were drunk u bak at college yet my work sends ink bath
ham,should i be stalking u
ham,ok sweet dreams
ham,hi can i please get a lt gt dollar loan from you i ll pay you back by mid february pls
spam,moby pub quiz win a high street prize if u know who the new duchess of cornwall will be txt her first name to unsub stop sp
ham,yep then is fine or for ice age
ham,i will be outside office take all from there
spam,sms services for your inclusive text credits pls gotto www comuk net login qxj unsubscribe with stop no extra charge help comuk cm ae
spam,free for st week no nokia tone ur mob every week just txt nokia to get txting and tell ur mates www getzed co uk pobox w wq norm p tone
ham,don no da whats you plan
ham,nah im a perpetual dd
ham,dunno leh cant remember mayb lor so wat time r we meeting tmr
ham,beautiful truth against gravity read carefully our heart feels light when someone is in it but it feels very heavy when someone leaves it goodmorning
ham,ok set let u noe e details later
ham,yes they replied my mail im going to the management office later plus will in to bank later also or on wednesday
ham,it is only yesterday true true
ham,will be office around pm now i am going hospital
ham,even my brother is not like to speak with me they treat me like aids patent
ham,cause im not freaky lol
ham,yeah ill leave in a couple minutes amp let you know when i get to mu
ham,wherres my boytoy
ham,hmm dunno leh mayb a bag goigng out dat is not too small or jus anything except perfume smth dat i can keep
spam,ur cash balance is currently pounds to maximize ur cash in now send cash to only p msg cc po box tcr w
ham,this is ur face test lt gt select any number i will tell ur face astrology am waiting quick reply
ham,hi happy new year i dont mean to intrude but can you pls let me know how much tuition you paid last semester and how much this semester is thanks
ham,any way where are you and what doing
ham,thats fine ill bitch at you about it later then
ham,i can make lasagna for you vodka
ham,boo im on my way to my moms shes making tortilla soup yummmm
ham,friendship is not a game to play it is not a word to say it doesn t start on march and ends on may it is tomorrow yesterday today and e
ham,tomarrow i want to got to court at lt decimal gt so you come to bus stand at
ham,ok but knackered just came home and went to sleep not good at this full time work lark
spam,update now mths half price orange line rental mins call mobileupd on or call optout j q
spam,u can win of music gift vouchers every week starting now txt the word draw to tscs www ldew com skillgame winaweek age ppermesssubscription
ham,do you know why god created gap between your fingers so that one who is made for you comes amp fills those gaps by holding your hand with love
ham,how are you enjoying this semester take care brother
spam,p alfie moons children in need song on ur mob tell ur m s txt tone charity to for nokias or poly charity for polys zed profit charity
ham,howz pain hope u r fine
ham,kinda first one gets in at twelve aah speak tomo
spam,thanks your continued support your question this week will enter u in our draw cash name the new us president txt ans to
ham,i will vote for wherever my heart guides me
ham,huh hyde park not in mel ah opps got confused anyway if tts e best choice den we juz have to take it
spam,get a free mobile video player free movie to collect text go to its free extra films can be ordered ts and cs apply yrs only
ham,sorry ill call later
ham,im in school now n ill be in da lab doing some stuff give me a call when r done
ham,yeah hopefully if tyler cant do it i could maybe ask around a bit
ham,waiting for your call
ham,how much are we getting
ham,poor girl cant go one day lmao
ham,hi babe its me thanks for coming even though it didnt go that well i just wanted my bed hope to see you soon love and kisses xxx
ham,uncle g just checking up on you do have a rewarding month
ham,i reach home safe n sound liao
spam,ur ringtone service has changed free credits go to club mobiles com to choose content now stop txt club stop to p wk club po box mk wt
spam,message important information for o user today is your lucky day find out why log onto http www urawinner com there is a fantastic surprise awaiting you
ham,aight thatll work thanks
ham,k im ready lt gt
ham,my planning usually stops at find hella weed
ham,customer place i will call you
spam,ur balance is now next question complete the landmark big a bob b barry or c ben text a b or c to good luck
ham,hi im always online on yahoo and would like to chat with you someday
ham,then its most likely called mittelschmertz google it if you dont have paracetamol dont worry it will go
ham,new theory argument wins d situation but loses the person so dont argue with ur friends just kick them amp say im always correct
ham,get ready to put on your excellent sub face
ham,hi darlin im on helens fone im gonna b up the princes nite please come up tb love kate
ham,both i shoot big loads so get ready
spam,january male sale hot gay chat now cheaper call national rate from p min cheap to p min peak to stop texts call p min
ham,hey great deal farm tour am to pm pax deposit by may
ham,ard like dat lor we juz meet in mrt station then dun haf to come out
ham,yo my trip got postponed you still stocked up
ham,super da good replacement for murali
ham,good afternoon my boytoy how goes that walking here and there day did you get that police abstract are you still out and about i wake and miss you babe
ham,mah b ill pick it up tomorrow
ham,my sort code is and acc no is the bank is natwest can you reply to confirm ive sent this to the right person
ham,how much i gave to you morning
ham,no im not i cant give you everything you want and need you actually could do better for yourself on yor own youve got more money than i do i cant get work i cant get a man i cant pay the rent i cant even fill my fucking gas tank yes im stressed and depressed i didnt even call home for thanksgiving cuz ill have to tell them i m up to nothing
ham,maybe i could get book out tomo then return it immediately or something
ham,thanks for the temales it was wonderful thank have a great week
ham,yeah i should be able to ill text you when im ready to meet up
ham,you call times job today ok umma and ask them to speed up
ham,did u see what i posted on your facebook
ham,yup n her fren lor im meeting my fren at
ham,ron say fri leh n he said ding tai feng cant make reservations but he said wait lor
ham,how are u i have missed u i havent been up much a bit bored with the holiday want go bak college sad isnt it xx
ham,theres someone here that has a year lt gt toyota camry like mr olayiwolas own mileage is lt gt k its clean but i need to know how much will it sell for if i can raise the dough for it how soon after landing will it sell holla back
spam,urgent we are trying to contact u todays draw shows that you have won a prize guaranteed call from land line claim valid hrs only
ham,hey u still at the gym
ham,i got your back do you have any dislikes in bed
ham,den only weekdays got special price haiz cant eat liao cut nails oso muz wait until i finish drivin wat lunch still muz eat wat
ham,bbq this sat at mine from ish ur welcome come
ham,bloody hell cant believe you forgot my surname mr ill give u a clue its spanish and begins with m
ham,hey babe far spun out spk at da mo dead da wrld been sleeping on da sofa all day
ham,fuuuuck i need to stop sleepin sup
ham,misplaced your number and was sending texts to your old number wondering why ive not heard from you this year all the best in your mcat got this number from my atlanta friends
ham,sorry da today i wont come to play i have driving clas
ham,then just eat a shit and wait for ur monkey face bitch u asshole
ham,im done just studyn in library
ham,oh sorry please its over
ham,so u workin overtime nigpun
ham,as in different styles
ham,so that takes away some money worries
ham,go until jurong point crazy available only in bugis n great world la e buffet cine there got amore wat
ham,im at work please call
ham,u ned to convince him tht its not possible witot hurting his feeling its the main
spam,want a new video phone anytime any network mins half price line rental free text for months reply or call for free delivery
ham,open rebtel with firefox when it loads just put plus sign in the user name place and it will show you two numbers the lower number is my number once you pick that number the pin will display okay
ham,ya had just now onion roast
ham,was actually sleeping and still might when u call back so a text is gr you rock sis will send u a text wen i wake
ham,juz go google n search qet
ham,that depends how would you like to be treated
ham,yes we are chatting too
ham,hi babe uawake feellikw shit justfound out via aletter thatmum gotmarried thnov behind ourbacks fuckinnice selfish
spam,kick off a new season with wks free goals news to ur mobile txt ur club name to eg villa to
ham,he has lots of used ones babe but the model doesnt help youi have to bring it over and hell match it up
spam,ur cash balance is currently pounds to maximize ur cash in now send go to only p msg cc hg suite lands row w j hl
ham,lol no i just need to cash in my nitros hurry come on before i crash out
ham,i wanna watch that movie
ham,i hav almost reached call i m unable to connect u
ham,sad story of a man last week was my bday my wife didnt wish me my parents forgot n so did my kids i went to work even my colleagues did not wish
ham,lol oh you got a friend for the dog
ham,do you know why god created gap between your fingers so that one who is made for you comes amp fills those gaps by holding your hand with love
ham,haha that was the first person i was gonna ask
spam,had your contract mobile mnths latest motorola nokia etc all free double mins text on orange tariffs text yes for callback no to remove from records
ham,boo what time u get out u were supposed to take me shopping today
ham,cbe is really good nowadays lot of shop and showrooms city is shaping good
ham,hey im bored so im thinking of u so wat r u doing
ham,no need to ke qi too bored izzit y suddenly thk of this
ham,i ll have a look at the frying pan in case it s cheap or a book perhaps no that s silly a frying pan isn t likely to be a book
ham,yun buying but school got offer plus only
ham,yeah probably but not sure ilol let u know but personally i wuldnt bother then again if ur goin to then i mite as well
ham,tunde how are you doing this is just wishing you a great day abiola
ham,yeah jays sort of a fucking retard
ham,i want to be there so i can kiss you and feel you next to me
spam,urgent ur awarded a complimentary trip to eurodisinc trav aco entry or to claim txt dis to morefrmmob shracomorsglsuplt ls aj
ham,how much r willing to pay
ham,sounds like a plan cardiff is still here and still cold im sitting on the radiator
ham,until lor ya can go dinner together
ham,hey is rite u put evey mnth is that all
spam,summers finally here fancy a chat or flirt with sexy singles in yr area to get matched up just reply summer now free join optout txt stop help
ham,when i was born god said oh no another idiot when you were born
ham,if anyone calls for a treadmill say youll buy it make sure its working i found an ad on craigslist selling for lt gt
ham,ok ok take care i can understand
ham,same here but i consider walls and bunkers and shit important just because i never play on peaceful but i guess your place is high enough that it dont matter
ham,i ll post her out l r in class
ham,nooooooo im gonna be bored to death all day cable and internet outage
ham,ok
ham,i will see in half an hour
ham,cant believe i said so many things to you this morning when all i really wanted to say was good morning i love you have a beautiful morning see you in the library later
ham,yupz ive oredi booked slots my weekends liao
ham,dunno y u ask me
ham,brainless baby doll d vehicle sariyag drive madoke barolla
ham,awesome question with a cute answer someone asked a boy how is ur life he smiled amp answered she is fine gudnite
ham,the fact that youre cleaning shows you know why im upset your priority is constantly what i want to do
ham,do noe if ben is going
ham,ok ill tell the company
ham,i wish things were different i wonder when i will be able to show you how much i value you pls continue the brisk walks no drugs without askin me please and find things to laugh about i love you dearly
ham,dont let studying stress you out l r
ham,babe im back come back to me
ham,annoying isnt it
ham,see the forwarding message for proof
ham,it will stop on itself i however suggest she stays with someone that will be able to give ors for every stool
ham,i wonder if youll get this text
spam,our mobile number has won to claim calls us back or ring the claims hot line on
ham,beautiful truth against gravity read carefully our heart feels light when someone is in it but it feels very heavy when someone leaves it good night
spam,for sale arsenal dartboard good condition but no doubles or trebles
ham,lol u drunkard just doing my hair at d moment yeah still up tonight wats the plan
ham,well you told others youd marry them
ham,ya im referin to meis ex wat no ah waitin u to treat somebody shld b rich liao so gd den u dun have to work frm tmr onwards
spam,free nokia or motorola with upto mths price linerental free x net mins txt mth free btooth call mobileupd on or call optout d wv
ham,dear will call tmorrow pls accomodate
ham,text her if she doesnt reply let me know so i can have her log in
ham,neither in sterm voice im studying all fine with me not sure the thing will be resolved tho anyway have a fab hols
ham,nope juz off from work
ham,short but cute be a good person
ham,you give us back my id proof and lt gt rs we wont allow you to work we will come to your home within days
ham,anything
spam,dear xxxxxxx uve been invited to xchat this is our final attempt to contact u txt chat to p msgrcvdhg suite lands row w j hl ldn yrs
ham,yar lor actually we quite fast cos da ge slow wat haha
ham,it doesnt make sense to take it there unless its free if you need to know more wikipedia com
ham,aight sounds good when do you want me to come down
ham,ok then i will come to ur home after half an hour
ham,great i was getting worried about you just know that a wonderful and caring person like you will have only the best in life know that u r wonderful and gods love is yours
ham,best msg its hard to be with a person when u know that one more step foward will make u fall in love amp one step back can ruin ur friendship good night
ham,if i let you do this i want you in the house by am
ham,erm ill pick you up at about pm thatll give enough time to get there park and that
ham,where u been hiding stranger
ham,then u go back urself lor
ham,alright omw gotta change my order to a half th
spam,recpt you have ordered a ringtone your order is being processed
ham,ok i shall talk to him
ham,yunny im walking in citylink now faster come down me very hungry
ham,ill pick you up at about pm to go to taunton if you still want to come
spam,free st week entry textpod a chance win gb ipod or cash every wk txt vpod to ts cs www textpod net custcare
ham,no one interested may be some business plan
ham,ha then we must walk to everywhere cannot take tram my cousin said can walk to vic market from our hotel
ham,great to hear you are settling well so whats happenin wit ola
ham,hey loverboy i love you i had to tell i look at your picture and ache to feel you between my legs fuck i want you i need you i crave you
ham,not enufcredeit tocall shall ileave uni at get a bus to yor house
ham,under the sea there lays a rock in the rock there is an envelope in the envelope there is a paper on the paper there are words
ham,u haven t lost me ill always b here u i didn t intend hurt u but i never knew how u felt about me when iwas marine that s what itried tell urmom i careabout u
ham,yes there were many sweets
ham,hi missed your call and my mumhas beendropping red wine all over theplace what is your adress
ham,lol what happens in vegas stays in vegas
ham,s now only i took tablets reaction morning only
ham,darren was saying dat if u meeting da ge den we dun meet dinner cos later u leave xy will feel awkward den u meet him lunch lor
ham,u coming back dinner rite dad ask me so i re confirm wif u
ham,k if u bored up just come to my home
ham,sorry was at the grocers
ham,frndship is like a needle of a clock though v r in d same clock v r nt able met evn if v meet itz only few seconds bt v alwys stay conected gud t
ham,hi dude hw r u da realy mising u today
ham,can i meet at as where depends on where wan in lor
ham,actually nvm got hella cash we still on for lt gt ish
spam,u have a secret admirer who is looking make contact with u find out who they r reveal who thinks ur so special call on
ham,it s to get in is that ok
ham,i re met alex nichols from middle school and it turns out hes dealing
spam,urgent ur awarded a complimentary trip to eurodisinc trav aco entry or to claim txt dis to morefrmmob shracomorsglsuplt ls aj
ham,good morning pookie pie lol hope i didnt wake u up
ham,lol nah wasnt too bad thanks its good to b home but its been quite a reality check hows ur day been did u do anything with website
ham,u know we watchin at lido
spam,want to funk up ur fone with a weekly new tone reply tones u this text www ringtones co uk the original n best tones gbp network operator rates apply
ham,only just got this message not ignoring you yes i was shopping that is
ham,good afternoon starshine hows my boytoy does he crave me yet ache to fuck me sips cappuccino i miss you babe teasing kiss
spam,reply with your name and address and you will receive by post a weeks completely free accommodation at various global locations www phb com ph p
ham,im late tellmiss im on my way
ham,i dont know exactly could you ask chechi
ham,if you r home then come down within min
ham,huh but i got lesson at lei n i was thinkin of going to sch earlier n i tot of parkin at kent vale
ham,bot notes oredi cos i juz rem i got
spam,u have won a nokia plus a free digital camera this is what u get when u win our free auction to take part send nokia to now pobox tcr w
ham,we are supposed to meet to discuss abt our trip thought xuhui told you in the afternoon thought we can go for lesson after that
ham,if youre still up maybe leave the credit card so i can get gas when i get back like he told me to
ham,may b approve panalam but it should have more posts
ham,and is there a way you can send shades stuff to her and she has been wonderful too
ham,you are always putting your business out there you put pictures of your ass on facebook you are one of the most open people ive ever met why would i think a picture of your room would hurt you make you feel violated
ham,huh but i cant go ur house empty handed right
spam,urgent call from landline your complimentary ibiza holiday or cash await collection sae t cs po box sk wp ppm
ham,where do you need to go to get it
ham,no did you check i got his detailed message now
ham,no just send to you bec you in temple na
ham,i notice you like looking in the shit mirror youre turning into a right freak
ham,another month i need chocolate weed and alcohol
ham,we are both fine thanks
ham,your daily text from me a favour this time
ham,hey so whats the plan this sat
ham,ok i am on the way to home hi hi
ham,otherwise had part time job na tuition
ham,ok i feel like john lennon
ham,only send me the contents page
spam,important message this is a final contact attempt you have important messages waiting out our customer claims dept expires call now
spam,we tried to contact you re your reply to our offer of a video phone anytime any network mins half price line rental camcorder reply or call
spam,urgent your mobile number has been awarded with a prize guaranteed call from land line claim valid hrs only
