emotion,utterance
neutral,i mean it s like every guy i see i mean look here
neutral,yeah its in there
anger,you know what else i m not gonna miss
anger,you sick freak who does that i cant believe i had a crush on you
surprise,ow ow
fear,no ross ross ross my child has no father
sadness,oh i wish there was something i can do to make you feel better
non-neutral,can you believe it i mean dont i seem like somebody who should be doing something really
fear,uh oh
surprise,well when jake did it i saw that he was wearing women s underwear
non-neutral,but when we were in high school i made out with james farrell even when i knew that you liked him
neutral,yes
sadness,i mean i remember a time when
surprise,somebody went to college wow what is it i m sorry
disgust,hi uh nothing that horrible woman just took my machine
neutral,we will take a moonlit walk on the rue de la
anger,i don t care
joy,hi
sadness,so long vic
sadness,look i just saw my best friends brains smeared across the canvas that s not gonna be me not me
disgust,okay i hear you are you capable of talking about any thing else
anger,all right thats thats it get off her
joy,yeah i love you okay bye hi
non-neutral,yeah i know its ridiculous i cant see you either
anger,pizza we like pizza get out
fear,oh i can t watch this
sadness,okay good bye good bye
neutral,so see ya on saturday
surprise,what they wanted a scary story
neutral,ohh you guys remember that cute client i told you about i bit him
neutral,hey rachel isnt that stuff almost pure
neutral,yknow if youre gonna work late i could look in on him for you
fear,its all good okay bye bye mon shes shes gonna kill me
joy,with them i m one hot chicky
fear,sweetheart just gimme gimme another chance okay well start all over again well go back to aruba
non-neutral,all right i just got changed in thirty seconds so you can be alone with him youd better go for it
surprise,my god okay ha ha ha beat ya sucker
anger,cut me a real piece
non-neutral,he is so weird
neutral,i ll be there
fear,whatre we gonna do whatre we gonna do
neutral,i want to keep one
joy,see ya phoebe oh and hey thanks for chipping in
non-neutral,its like like shes the princess and im the stable boy why are you doing this huh
joy,hey
surprise,were in a relationship
anger,son of a bitch
surprise,hey me too
anger,i thought i told you to get outta here
surprise,how can i
surprise,what s this
sadness,sorry
disgust,youre making a big mistake here
sadness,i m sorry
non-neutral,oh im still mad at them but i also now that they bring happiness to lots of kids whos moms didnt kill themselves so by supporting them im doing a good thing but im not
sadness,y know i know that i said that i am totally okay with ross getting married but as it turns out i don t think i m handling it all that well
joy,i know i found it on the street
fear,let her know i like her
anger,i don t have time for this
neutral,ok who wants to hear something ironic
surprise,are you kidding
fear,that was alices mom she said she left five hours ago she should be here by now
joy,i can t believe you re getting married
non-neutral,it was the ring
non-neutral,oh god
joy,ooh phoebe s here okay let s turn out all the lights and we ll just watch the movie
sadness,okay i m sorry
joy,hi
neutral,hello
surprise,its still there
surprise,whoa what why
disgust,ugh monica i know about you and chandler
neutral,i really thought you making a good point i mean yknow until you got cut off
non-neutral,but it is a big deal i have to tell someone
non-neutral,things happen and they happen
surprise,what
disgust,ew what is that something exploded
neutral,well it does not ring a bell with me
surprise,what
neutral,well you know you have to take a course otherwise they dont let you do it
joy,oh that s so exciting
fear,i i i have to tell you something
fear,uh oh bruiser has becker on the canvas and is going for his favourite area
anger,you invite my brother you invite my whole family and not me
surprise,excuse me
sadness,don t go
joy,hey there little fella
joy,and you get all these like mental images in your brain you know like elle macpherson or that girl at the xerox place
anger,come on
joy,sweetie with you it s gonna be different the sex is gonna be great cause you you guys are in love
disgust,hey lady i dont care how much you want it okay i am
neutral,all right well i just cant think about that right now i just wanna say good bye to my grandma
fear,no no no we gotta go come on here we go
surprise,flying a jet
anger,i dont need this right now ok
non-neutral,ohh ohh
neutral,no no it was the candles
non-neutral,i mean we we told joey he cried his eyes out
non-neutral,its okay to laugh right
disgust,you freak
anger,bastard
anger,look
non-neutral,could tonight be the night
sadness,im sorry honey i promise it will never happen again
anger,hi is my misery amusing to you
fear,the charitys on fire
sadness,aww pheebs that sucks
surprise,the ring is gone
non-neutral,sophie would you please climb out of my butt why hasn t he called rachel why
surprise,ohh
sadness,so if you wear that you ll make mine less special
non-neutral,ahh no
disgust,about a month ago this guy spent the night with rachel i didn t see who it was but
sadness,im okay i gotta go down to the police station and look at mug shots
joy,thats great
sadness,sure i feel so bad for you i broke my leg once too
joy,i can t believe you re gonna ask monica to marry you
joy,well maybe we will oh
anger,i ll do it without you
neutral,even when i found out umm all right well lets just say i found something out something about someone and lets just say shes gonna keep it
neutral,can i help you
fear,you ve got to get out of here save yourself
surprise,what
surprise,i licked my arm what
disgust,oh wait joey you can t go like that you stink
non-neutral,oh i know
anger,of course not it smells like wine which you spilled and thanks for wrecking my sheet by the way
neutral,huh what s fish hooking thanks man that would have been really hard to describe what is that taste
joy,oh oh im a duck i go quack quack i m happy all the time
joy,push
neutral,that s bill clinton
disgust,no i don t
surprise,why
neutral,what
sadness,ohh i lost my mom to suicide
sadness,the doctor says its a matter of hours
sadness,no me i am so sorry
anger,oh yes there is
fear,i mean have you seen a car come by here in the last hour and a half
neutral,tag
disgust,oh my god ohh that is it i m leaving you are just a horrible person
non-neutral,yeah
joy,i bet it has a great story behind it too
sadness,i cant believe that ross is gone it is just so sad
surprise,oh my god you re a year old virgin
neutral,yeah he s the reason i didn t get that big
joy,everybody smile okay thanks a lot enjoy your stay at
neutral,phoebe we re getting
surprise,oh i so cant believe this my uterus is an inhospitable environment i was trying so hard to be a good hostess
surprise,whoa
sadness,oh honey come on i m sorry i didn t
anger,ohh phoebe this is all your fault now he loves her he s gonna marry her and this is all your fault
fear,come on guys i i really want this guy to like me
sadness,i i wasn t in that
sadness,listen i ah i gotta say good bye and and i gotta say it quick cause this is killing me
disgust,dont you realise what youre youre doing to yourself
surprise,eh monica it it feels so weird yknow chandler s your friend oh
anger,did you get all this stuff for joey to try and drive me out of the apartment
non-neutral,oh so forget about the birds but big red insects suggest fine dining
neutral,what
anger,i mean enough of the silliness
fear,i ve kinda of had this ah this crush on you
joy,i know
fear,help
anger,my fault you threatened the judge
sadness,i can get out joey i have too but then i lose my nerve and i always finish with go to the bathroom
anger,cause i dont need your stupid ship
sadness,oh see now i feel bad for the kid
disgust,ugh
surprise,wow that s exciting you went to japan made up a woman
non-neutral,and ross with his over pronouncing every single word
surprise,oh my god monica s gonna go out with a millionaire
sadness,i tried to reach you at work there s been a fire
neutral,all right i see what you guys are saying ill uh ill go downstairs and fill out an application
sadness,bye chandler i miss you already
surprise,oh really
sadness,umm listen i am sorry but i ll put some out first thing in the morning
fear,uh pheebs some people call that breaking and entering
fear,by then the cheesecake may have gone bad we don t want her to come back to bad cheesecake
non-neutral,well maybe it s so big because the house was built on radioactive waste
non-neutral,the front page you really do live in your own little world don t ya
non-neutral,this is not going to work
fear,well i i said yes
surprise,the weirdest thing happened at the coffee house i think i think phoebe was hitting on me
disgust,okay hating this
surprise,man can you believe hes only had sex with one woman
fear,sur surprise him were not were not gonna make anybody mad are we
non-neutral,guys
disgust,yeah hate him
joy,oh oh that s great
joy,yes she s gonna help us take care of the baby woo hoo
sadness,oh poor lily
joy,he is so cute
non-neutral,i did but the store wouldn t take her back so then i took her to the shelter and you know what i found out
anger,you dont even know me
non-neutral,oh stop it joey already told me
surprise,four hours you guys have been doing this for four hours
anger,in a minute
neutral,but i was just thinking that since those guys just got engaged that maybe it would be nice if they had some privacy y know
disgust,ohh get a room
joy,um the matador ole ha ha ha
anger,it was my quarter
anger,that almost hit me in the face
disgust,i mean look at him look at you
sadness,oh my god we are throwing the most depressing baby shower ever
disgust,rachel its not that your friend is bad its that shes so bad she makes me want to put my finger through my eye into my brain and swirl it around
surprise,whoooaa
sadness,oh i wanna quit but then i think i should stick it out then i think why would such a person stay in such a demeaning job just because it s remotely related to the field they re interested in
anger,it s clint
disgust,oh no
sadness,oh i know
sadness,okay i m sorry
surprise,you know it
non-neutral,all the time
fear,take whatever you want just please don t hurt me
surprise,what s fish hooking
neutral,yeah like that thought never entered my mind
surprise,the uh the baby that hasnt been born yet wouldnt that mean youre crazy
disgust,yeah yeah you go talk to your friend you tell him nice try
sadness,oh please he ll be with his real family the twins and little miss new boobs
joy,oh oh oh i ll get rainy day bear
sadness,but you ve got things you have to do now and so do i
surprise,oh i thought you guys got married in uh january
surprise,hi and youre going into what grade
surprise,wow how do you know how to do that
joy,that s a dog every house should have a dog
anger,fine i m mentally unstable
neutral,ah just one other thing
neutral,yeah
anger,please this is so your fault
sadness,and to go from that to this i just plus i d have to wait on all my friends
sadness,were sorry pheebs were sorry
joy,yeah i feel kinda bad for them but i m also really psyched cause i don t have to move in here
non-neutral,get out of here you lurker go on get
neutral,so uh you re not gonna be able to live here for a while you ladies have a place to stay
sadness,god it s gonna so weird like when i come home and you re not here
disgust,you re marinara sauce tasted like tomato juice
fear,and i need to flip the light switch on and off times before i leave a room or my family will die
non-neutral,pheebs
anger,shes living my life and shes doing it better than me
surprise,what what
fear,thanks but i kinda have a problem to deal with here
neutral,hi remember us
sadness,well i i got this blinding pain in my stomach when i was lifting weights before then i uh passed out and uh haven t been able to stand up since
joy,hey
sadness,cause carol s a lesbian and and i m not one and apparently it s not a mix and match situation
disgust,oh ew
non-neutral,oh yeah um alright i kinda need a divorce
anger,oh you re kidding me
non-neutral,would you please go
fear,did she call you you told her i was sick right always tell her i am sick
anger,go get back on that case honey
fear,shes not gonna make you wear one of those big plastic cones is she
neutral,you wanna you wanna grab some coffee
non-neutral,no no no no
joy,id like to propose a toast
sadness,what i m just said
neutral,so i though about what you said and i though about what he said and well his way i get to have sex tonight so
neutral,yeah she s fired
fear,just uh just stand up straight
anger,like like like i did something terrible to you
neutral,and uh and david over there i heard he doesn t wear a cup
joy,definitely phoebe you will not find a single game show host who s ass i cannot kick
non-neutral,hey how do you guys get anything done
anger,nooo nooooo you lent me monicas earrings im not allowed to borrow her stuff
fear,there huh hmm there there was an incident
neutral,well oh just ah i was just wondering when you and i split up did you get the tape that was half the last episode of
fear,monica kinda trusted me with something and she shouldn t have
disgust,no
anger,no
surprise,of course i am i just have to make a call
fear,listen do you think and try not to let my intense vulnerability become any kind of a factor here but do you think it would be okay if i asked you out
sadness,because she s not gonna get to keep the babies
joy,go go go
anger,horny bitch no you re a horny bitch noooo you re the horny bitch no you re a horny bitch
fear,i m going crazy okay do you have any thing around here that looks homemade
disgust,can we turn the tv off okay do we really want to spend the entire weekend like this
neutral,well you re making him a frieze salad with goat cheese and pine nuts wild nuts wild rice roast asparagus and salmon au croup
anger,all right thats it i quit
non-neutral,umm yeah actually susan s gonna be home any minute it s kinda an anniversary
fear,oh god
neutral,you know barracuda was the first song i learned to play on the keyboard
joy,ho ho you win dollars
anger,it s my turn
fear,i was scared of telling you
anger,no you have been screwing us all day
neutral,i was thinking maybe maybe maybe it could be a game room y know
sadness,i mean i ll go to the airport with ya i i wanna say good bye
disgust,she sells drugs to kids
joy,so i m here ready to play
surprise,oh yeah
non-neutral,oh well that s great so i guess this is ah this is good bye then huh good bye
fear,well theres no way im gonna get a shot
disgust,oh classy
sadness,dad we we can t believe you re selling the house
disgust,they rushed into this thing so fast it s ridiculous
non-neutral,hes in the bathroom i dont think you wanna go in there
joy,hey
fear,honey i swear i wasn t looking at her
disgust,uh huh
surprise,really
neutral,miss may i help you
surprise,what what what
non-neutral,come on you saw the way he ran out of here
surprise,what
fear,uh oh
non-neutral,remoray
sadness,well it s just my entire family was run out of scotland by vikings anyway lots of bad memories
surprise,oh my god that s pete but why is bill huggin pete
anger,thats it
surprise,so that s it
joy,i mean gosh chandler what you did its its a wonderful thing and i really appreciate it
non-neutral,vic vic
surprise,joey uh
joy,oh i would love to
joy,second date
disgust,to tape the game you do this every time ross you re
non-neutral,ahh nooo
fear,oh boy i just cant watch its too scary
disgust,you don t know how that happened your dog thought my diaphragm was a chew toy
surprise,oh
non-neutral,oh ross you re right i don t know why i always thought this was real grass
sadness,and then apart and then together and then apart and now we have a baby
surprise,ahh
fear,look i look i m having a great time with you and i just don t want us to move to fast or put to much pressure on us
disgust,including umm evil bitch and uh sick bastard
joy,oh wow uh yeah that sounds great i m just gonna put this back in my pocket pretend
joy,we got the grant three years all expenses paid
joy,its just its just the luckiest baby in the whole world
anger,and you i throw myself at you and you say no how gay are you
joy,thanks for letting me stay here i mean monica s place was nice but her fianc e sure stares a lot
joy,yeah i m gonna have a baby i m gonna have a baby i m gonna have a baby
sadness,i am so sorry
surprise,oh my god
non-neutral,you you you didn t know that well i guess my work here is done
anger,what are you talking about ross you just said that you read it twice
sadness,sorry
neutral,hi okay don t be mad at me but i couldn t resist
disgust,oh come on
disgust,it makes him miss the bowl but whatever
anger,because i sure as hell can t figure it out
anger,i m pregnant ross ross okay whenever you re ready and you re the father by the way but you got that
non-neutral,ross what are you im sorry sir i just i think he just really likes you
sadness,oh this life oh okay no chandlers is worse
sadness,yknow what the saddest part is when we were playing together that was like the most fun i ve ever had in like all my lives
anger,go
anger,well why don t think of someone else for a change
joy,thank you thank you thank you and
neutral,i got here a little early myself
fear,i know
disgust,save it red unless you wanna spend the night in the slammer you apologize to the tree
anger,look this is my home and i want to be able to come and go whenever i want
surprise,what
anger,come on man youve been here all day
surprise,cause they cause they thought it was a boy but chandlers a girl
non-neutral,well i don t understand why adrienne s attracted to victor
non-neutral,no you can t let this stop you from getting massages
neutral,no no he s not
neutral,im only eating the skin so the chickens up for grabs
disgust,i don t even know the man okay we re not that close i haven t seen him in years
surprise,phoebe you got joey drums to annoy rachel so she wouldnt wanna live there anymore
surprise,uh huh wow well look there s frank
surprise,oh i knew it what happened
neutral,yeah we both can and we both will
surprise,they musta read the sonogram wrong
sadness,oh im sorry oh i just i thought we could have them whipped and then add some peas and onions
anger,you stole them from me
anger,she keeps lying to me
neutral,bye
sadness,where does that leave me
neutral,hi
non-neutral,good job today
joy,oh yeah i d love that
anger,because i sure as hell can t figure it out
non-neutral,hey
disgust,close shes got her tongue in his ear
fear,no don t i beg of you
non-neutral,my wife s a lesbian
neutral,come on
surprise,my god
surprise,i can t believe it
joy,one hundred percent natural
non-neutral,she says marcels humping things not a phase apparently hes reached sexual maturity
neutral,i m going to the bathroom
disgust,or else youre pretending that youre seeing somebody which just makes you so pathetic that i could start crying right here in the cereal aisle
non-neutral,have i got a surprise for you pack your bags
surprise,ah oh
disgust,you slept with somebody three hours after you thought you broke up i mean bullets have left guns slower
sadness,oh god i knew it that i freaked you out
sadness,my late husband gave me that lighter im not kidding
disgust,what do you think youre gonna do have sex with her right here on my couch
anger,y know what tag if we went down to the office you would see those contracts sitting on your desk
neutral,if you have the big apartment you have to deal with people coming over all the time
fear,well i i got this blinding pain in my stomach when i was lifting weights before then i uh passed out and uh haven t been able to stand up since
joy,yeah it s about relationships y know the traps the pitfalls what not to do keep going this stuff is great
fear,oh god
fear,no no big bear big bear outside i think i i would you actually would you go check on that
surprise,really
surprise,ross geller why do i know that name it s uh wait did you write this
surprise,oh it has a name
non-neutral,i need to talk to you
sadness,yeah me too
joy,hi joey its jane rogers cant wait for your party tonight
surprise,it was like months ago
joy,oh she s gonna love that
joy,oh i just wanted to say hey
neutral,listen i know you wanted to talk to me but i have an idea that may make you want to stay married we register and
surprise,what
fear,please please we just dont want to deal with telling everyone okay just promise you wont tell
joy,we could or we can have sex in it
joy,wanted female roommate non smoker non ugly nice
disgust,oh my god you are pure evil
neutral,well half a brownie
non-neutral,well y know i m i mean who needs a savings account
anger,oh shut up you know its a rebuilding year you waah
non-neutral,i think there are people in there having sex
sadness,im gonna have to give him up
disgust,how rude
sadness,ohh okay i m sorry
joy,yeah
joy,push
joy,oh ooh oh monica it s so beautiful
surprise,maybe
joy,tulsa is heaven
anger,it doesn t say that in the script
neutral,yes if it really doesn t mean anything because you know that i m just not ready
non-neutral,did you not hear me say du ude
non-neutral,why would the little girl creep you out
surprise,hot coffee
fear,f hah flennin
sadness,divorced men s club
disgust,all right
sadness,yeah but i didn t get to see it
joy,hi jill
fear,you re welcome i m sorry did i hurt you
surprise,i m sorry sir i don t understand
non-neutral,it s just yknow been a couple of hours and she hasn t called not that i even care yknow
joy,you know the song sing along
disgust,not even if carols breast had a picture of a missing child on it
joy,i am not horsing around okay i am porsching around
anger,well how would you know you didnt even read it
neutral,but she said shes looking for someone and someone is gonna be there tonight
disgust,ewww
sadness,i m sorry daddy
surprise,you told her before you told us
fear,i said geez relax monnnnn
joy,we were playing gin yknow if we were a couple we could play this game naked
fear,i don t know what i m going to do
neutral,well at the christmas party him and santa did some definitely gay stuff
joy,no no ah everythings okay everybodys healthy theres fingers and toes
surprise,my apothecary table
sadness,i m sorry i m sorry i m sorry
disgust,no no
non-neutral,yknow she d say no but here we are
non-neutral,yeah its kinda sweet sorta like uh
disgust,did anybody else feel they just wanted to peel the skin off their body to have something else to do
sadness,well the old lady died
disgust,what s that smell
disgust,ah no no no just ross ross and joey is embarrassing enough
sadness,well first for forgetting to throw you a bridal shower
surprise,hey listen lady whoa
fear,but i really think i can do it i m just gonna need some help
sadness,hey uh i m really really sorry about what happened in the cafeteria today
anger,yeah no no
surprise,what happened in atlantic city
surprise,oh my god
fear,oh no
sadness,i can t
anger,arent we a little old for this
surprise,phoebs its open its open
anger,my son is being born and i should be in there you know instead of stuck in a closet with you
non-neutral,i mean it is so annoying
joy,you love me
disgust,oh well don t take it to the same place you took the stereo cause they ve had that thing for over a week
neutral,all right now im going to get back to my bucket
anger,and this is not the only hospital in this city and we have no problem to whoa
non-neutral,people have got to finish their stories
joy,yeah okay hey hi
non-neutral,no it s uh my ex wife whitney is out there i cannot deal with her right now that woman is crazy
anger,yeah
joy,all that stuff you said about true love you were right i mean we did learn a lot from mom and dad
fear,well i yknow i was just umm i was just thinking and hoping that umm maybe you d want to get back together
joy,fine maybe i will too
non-neutral,we really need to take those tests
sadness,oh god i m so sorry
surprise,oh my god
non-neutral,you re not the fan who s dying are you
neutral,i feel
neutral,yknow we work in a museum of natural history and yet there is something unnatural about the way we eat lunch
neutral,joey if i go first i wanna be looking for my keys
non-neutral,you had fantasies about emily
non-neutral,yes
surprise,hello oh hi ross see other people call me
neutral,or maybe he he was writing to tell her that that he s changed his name y know tell monica i m sorry
joy,rach you re in a great place in your life come on you ve got a great job good friends
neutral,no no they will i just uh
joy,kinda but i ve just been having way too much fun
surprise,i do
sadness,ok ok so youre not a fan but i mean come on you cannot do this to her
surprise,how how is this my fault
joy,hey
surprise,i m not
surprise,who told you that
joy,we have so much in common
neutral,oh my god honey we are so meant to be together we both have copies of the
surprise,jody
anger,you said i was boring ohh
disgust,cause you re a little princess daddy buy me a pizza daddy buy me a candy factory daddy make the cast of
anger,don t call us that
joy,hi joey its jane rogers cant wait for your party tonight
fear,when you re done over there we kinda have a situation over here too
surprise,wow that was good that was tweezers
non-neutral,then do iceberg
disgust,i m sorry i just can t go to the hospital lookin like this
anger,so i hear you hate me
disgust,whats with her
neutral,oh
neutral,no i ve just always wanted to do that can you help me clean this up
joy,thats fun
non-neutral,oh yeah thats right
anger,no suds no save ok
joy,yes
fear,how bad is this
disgust,i ate a bug
sadness,im so sorry no im sorry no im sorry no im sorry
anger,what you got us evicted
surprise,you have a son
joy,okay
neutral,what are you writing
sadness,oh im sorry
fear,i im sorry sorry
joy,sure i love this part
sadness,what can i do one person wants to break up you break up
